utterance,dishname_first (score),dishname_second (score),dishname_third (score),ingredient_first (score),ingredient_second (score),ingredient_third (score)
Can I brush melted butter on the edges of a pizza before cooking it?,melted (0.71),on the edges (0.96),pizza (0.77),butter (0.68),none,none
How can you ruin an expensive cut of steak?,expensive cut of steak (1.00),none,none,none,none,none
Can hard boiled eggs be made in a steamer?,hard boiled eggs (1.00),made in a steamer (0.99),none,none,none,none
What’s a good potato recipe for a terrible cook like myself?,good potato (1.00),terrible cook (0.77),none,none,none,none
How do I rescue a dish which is too salty or too oily?,dish (1.00),none,none,salty or (0.85),too (0.48),oily? (0.80)
What are the best tomato sauces (with herb or without) you use while cooking?,the best tomato sauces ( with herb or without ) you (1.00),none,none,none,none,none
"What's the quickest way to cook pinto beans, so I can make homemade refried beans?",quick (0.97),pinto beans (1.00),homemade refried beans (0.92),none,none,none
How do I saute spinach with olive oil?,spinach with olive oil? (0.95),none,none,sa (0.83),none,none
How long does it take to cook a sirloin roast?,sirloin roast? (0.99),none,none,none,none,none
How long does it take to cook wings at 400?,wings at 400? (1.00),none,none,none,none,none
"When making your pizza at home, how do you apply the toppings?",pizza (1.00),? (0.37),none,the (0.99),toppings (0.81),none
"Can I combine meat and fruit in a main dish? If so, what do you suggest?",meat and fruit in (1.00),main dish (1.00),none,none,none,none
What is your go-to 'save it from the trash’ recipe?,go - to'save it from the trash ’ (1.00),none,none,none,none,none
Why isn't dry pasta salted?,dry pasta salted? (1.00),none,none,none,none,none
What are some grilling tools that everyone should have?,everyone (0.42),none,none,grilling tools (1.00),none,none
How do I cook a rib eye roast in the oven?,rib eye roast in the oven (1.00),none,none,none,none,none
How do I reuse an undercooked steak?,undercooked steak (1.00),none,none,none,none,none
Why do you have to stir pasta in the bowl to prevent it from sticking?,pasta in the bowl (1.00),it (0.94),none,sticking (0.93),none,none
How long does it take to broil thick pork chops?,broil thick pork chops (0.99),none,none,none,none,none
What is gratin in cooking?,##atin in cooking (0.75),none,none,gr (0.80),none,none
What is the best thing to add to leftover pizza to make it taste fresh?,leftover pizza to (1.00),it taste fresh (0.98),none,none,none,none
How do I make a beef eye round roast?,beef eye round roast? (1.00),none,none,none,none,none
What is the cheapest way to make plain pasta taste better?,cheap (0.58),plain pasta taste better (1.00),none,none,none,none
Do you love pepperoni grease? Would you buy jars of it to cook with?,pepperoni grease (1.00),jars of it to (0.89),with (0.97),none,none,none
Does it ruin pasta to cook without salt?,pasta (0.44),without salt (1.00),none,none,none,none
Which spices do well in both sweet and savory recipes?,both sweet and savory recipes (0.99),none,none,spices (0.93),none,none
How many recipes out of a cookbook do you actually use?,recipes out (0.74),cookbook (1.00),none,none,none,none
"Does adding salt while shallow frying onions make them fry quicker? If so, what’s the reason behind it?",shallow frying (0.88),them fry quicker (0.97),none,adding salt while (0.79),onions (0.64),none
How can you make your beans more watery when cooking?,beans more watery when cooking (1.00),none,none,none,none,none
What can I do in the kitchen with a searing torch?,kitchen (1.00),torch (0.95),none,searing (0.61),none,none
Why do some people store salt in the refrigerator?,people store salt in the refrigerator (1.00),none,none,none,none,none
"Device I can buy or build myself to make (roll) Cheeseballs (basically some grinded vegetables/spices and different types of cheese shredded as well) before adding the breadcrumbs and egg yolk, because I have to roll like alot of balls?",( roll ) cheeseballs ( basically some grinded vegetables / spices and different types of cheese shredded as well ) (1.00),"breadcrumbs and egg yolk, (1.00)",like alot of balls (1.00),roll (0.97),none,none
"Can you make delicious cube steak in the microwave? Something without heavy salt, garlic, or onions.",delicious cube steak in the microwave? something (1.00),none,none,"heavy salt, garlic, or onions (0.97)",none,none
How long does a whole chicken last in a crock pot?,long (0.92),whole chicken last in a crock pot? (1.00),none,none,none,none
What's the easiest way to spice up a boring ole hamburger or hot dog on the grill at a BBQ? How? Why?,boring ole hamburger or hot dog on the grill at a bbq? how (0.99),none,none,none,none,none
How is cookie dough different than cake batter?,cookie dough (1.00),than cake batter (1.00),none,none,none,none
When I fry beef this grey stuff often comes out? What is it and how do I avoid it?,beef this grey stuff often comes out (0.99),none,none,it (0.90),it (0.84),none
What is a good way to cook cauliflower rice if you are a person who doesn't like cauliflower very much?,cauliflower rice (1.00),##uliflower very much (1.00),none,ca (1.00),none,none
What is the best set of pots for those who cook every day?,the best (0.63),pots (0.95),every day (0.85),none,none,none
Are ceramic utensils always microwave oven safe?,ceramic utensils always microwave oven safe (1.00),none,none,none,none,none
What can I cook without meat?,without (0.97),none,none,meat (0.88),none,none
How do I cut vegetables without the knife going off at an angle?,vegetables (1.00),none,none,the (1.00),knife going off (0.98),none
How do you make tomato sauce less tangy?,tomato sauce less tangy? (1.00),none,none,none,none,none
How long does it take for potatoes in a crock pot?,potatoes in a crock pot? (1.00),none,none,none,none,none
How long does it take to cook zucchini on a stove?,zucchini on a stove (1.00),none,none,none,none,none
How do you avoid rice sticking to the cooker?,rice sticking to the cooker (0.99),none,none,none,none,none
What seasonings do you use for your homemade fries?,homemade fries (1.00),none,none,seasonings (0.99),none,none
Do pasta and beans go together?,pasta and beans (1.00),none,none,none,none,none
Do you have to cook pasta before putting it in a slow cooker?,pasta (1.00),it in a slow cooker (1.00),none,none,none,none
How do I cook bass in the oven?,bass in the oven (1.00),none,none,none,none,none
What is the best way to cook canned soup?,canned soup? (1.00),none,none,none,none,none
What happens if you forget to dust the pan with flour before pouring cake batter in it and putting it in the oven?,pan with flour before pouring cake batter in it (1.00),oven (0.81),none,none,none,none
Does oil or butter help rise the dough?,dough (1.00),none,none,oil or butter (1.00),none,none
Can you cook 4 2-pound meat loafs at the same time?,4 2 - pound meat loafs (1.00),none,none,none,none,none
What’s the best way to reheat ground beef in the oven?,reheat ground beef in the oven (0.98),none,none,none,none,none
What are some tips for cooking without making a huge mess?,huge mess (1.00),none,none,none,none,none
How do I make store bought Alfredo sauce taste better?,store bought alfredo sauce taste better (1.00),none,none,none,none,none
What can you use instead of baking powder for pancakes?,baking powder for pancakes (0.99),none,none,none,none,none
Is hard pasta an indication that it was overcooked or undercooked?,pasta (0.75),overcooked or undercooked? (0.89),none,hard (0.55),none,none
What are some substitutions for flour when cooking pasta sauces that need to thicken a bit?,when cooking pasta sauces that (0.96),##en a bit (0.67),none,substitutions for flour (0.97),thick (0.99),none
What can be used as a substitute for Dijon mustard when making deviled eggs?,dijon mustard when making deviled eggs (1.00),none,none,none,none,none
Why are some pizzas under cooked on the bottom and burnt on the top?,pizzas under cooked on the bottom and burnt on the top (0.99),none,none,none,none,none
How do you drain the blood from burgers before cooking?,blood from burgers before (0.94),none,none,cooking (0.79),none,none
How do I cook pasta in a crock pot?,pasta in a crock pot? (0.93),none,none,none,none,none
Would it be weird/blasphemous to use roasted garlic instead of raw garlic in sauces and dressings?,weird / blasphemous to use roasted garlic instead of raw garlic in sauces and dressings (1.00),none,none,none,none,none
What's the best water temperature for making pizza dough?,the best water (0.99),pizza dough (1.00),none,none,none,none
What unexpected ingredient do you add to a dish?,dish (1.00),none,none,unexpected ingredient (0.97),none,none
Should I poke holes in steak before grilling?,holes (0.94),steak before grilling (1.00),none,none,none,none
"Do I need to change tongs, spoons, or other utensils I used when I started cooking meat midway through cooking to avoid contamination? Or can I use the same throughout the cooking process? Why or why not?","tongs, spoons, or other utensils i used when (0.99)",meat midway through cooking (1.00),same throughout the cooking process (0.95),contamination (1.00),why (0.73),why (0.52)
How do I use extra white boiled rice left after lunch?,extra white boiled rice left after lunch (1.00),none,none,none,none,none
How do you fix mushy pancakes?,mushy pancakes (1.00),none,none,none,none,none
Do you have a recipe that you don't share with anybody?,none,none,none,none,none,none
How do I deep fry without a thermometer?,deep (0.69),none,none,thermometer (0.90),none,none
How long should I quick soak my dry black beans?,so (0.99),dry black beans? (1.00),none,none,none,none
What can I do with a bad batch of brownies?,bad batch of brownies (1.00),none,none,none,none,none
What is the best way to cook purple sprouting broccoli?,purple sprouting broccoli? (1.00),none,none,none,none,none
How do you keep vegan pancakes from sticking together?,vegan pancakes from sticking together (1.00),none,none,none,none,none
"Whenever I boil pasta (specifically spaghetti), it always sticks to itself before I'm ready to use it. What can I do to avoid this without it becoming mushy (which happens if I keep it in the water)?",pasta ( specifically spaghetti ) (1.00),it always sticks (0.72),itself (0.63),it (0.93),it (0.44),water (0.60)
Why cooking is a good hobby?,none,none,none,cooking (0.76),none,none
What is the most delicious dish someone brought to a gathering that the person would not give out the recipe for? Did you ever find out how to make it?,most (0.97),delicious dish (0.72),gathering (0.43),none,none,none
How do I turn a dry rub into sauce?,dry rub into sauce (1.00),none,none,none,none,none
How can I save burnt pork ribs?,burnt pork ribs (1.00),none,none,none,none,none
How do you keep cornbread from sticking to the cast iron cornbread stick pans? Cooking spray doesn't seem to work too well.,cornbread from sticking to the cast iron cornbread stick pans? cooking spray (1.00),none,none,none,none,none
Can you use a deep fryer without the basket?,deep fryer (1.00),basket (0.99),none,the (1.00),none,none
What are the easiest non-pancake recipes that use pancake mix?,easiest non - pancake recipes that (0.96),##cake mix (1.00),none,pan (1.00),none,none
How do you cook female eggplants?,female eggplants? (0.99),none,none,none,none,none
How do you cook spleen?,spleen? (0.94),none,none,none,none,none
How do I cook a cure 81 ham?,cure 81 ham? (1.00),none,none,none,none,none
Does chopping steak negate the benefit of using better meat?,none,none,none,chopping steak (0.88),better meat (0.86),none
"If you want your potatoes to be baked quickly (dinner is in an hour) but you forgot to preheat the oven, should you put them in while preheating or not (baking, potatoes, cooking)?",potatoes (1.00),be baked quickly ( dinner is in an hour ) (1.00),##hea (0.68),pre (0.86),while (0.49),none
How long is dry pasta good for?,dry pasta (1.00),none,none,none,none,none
How long do you soak no-boil lasagna noodles?,no - boil lasagna noodles? (1.00),none,none,none,none,none
How can you reheat noodles without them sticking to each other?,reheat noodles (1.00),other (0.68),none,them (1.00),sticking (0.62),each (0.82)
Should I add salt to the batter of a fried food OR sprinkle salt after frying it?,batter (0.81),fried food or sprinkle salt after frying it (1.00),none,salt (0.79),none,none
Is there a pasta equivalent to risotto?,pasta (1.00),risotto (1.00),none,none,none,none
How long does it take to cook a turkey overnight?,turkey overnight (1.00),none,none,none,none,none
"When making fresh pasta, do I salt the water or the pasta itself?",fresh pasta (0.99),the water or the pasta itself (1.00),none,none,none,none
How do I grill without an actual grill?,grill (0.77),none,none,an (0.87),actual (0.98),none
How do you make great brown rice in a rice cooker?,great brown rice in a rice cooker (1.00),none,none,none,none,none
Is it better to fry bake or boil meatballs when making spaghetti and meatballs?,bake or boil meatballs when making spaghetti and meatballs (1.00),none,none,none,none,none
Can I use coconut oil instead of ordinary veg oil in a cake mix?,coconut oil instead of ordinary veg oil in a cake mix (1.00),none,none,none,none,none
What does butter do to tomato sauce?,tomato sauce (1.00),none,none,butter (0.90),none,none
How do I cook hard boiled eggs without the shell sticking to the egg?,hard boiled eggs (1.00),shell sticking to the egg (1.00),none,the (0.99),none,none
How do I make loaded baked potato soup?,loaded baked potato soup? (1.00),none,none,none,none,none
What are great-to-know tips for preparing clay pot cooking?,great - to - know (1.00),clay pot cooking? (0.98),none,none,none,none
How do I cook a beef round eye steak?,beef round eye steak (1.00),none,none,none,none,none
How do you cook frozen dumplings without a steamer?,frozen dumplings (1.00),none,none,a (0.92),steamer (1.00),none
What is the best way to reheat leftover gnocchi?,rehea (0.86),leftover gnocchi? (1.00),none,none,none,none
How do I cook stuffed mushrooms in an oven?,stuffed mushrooms in an oven (1.00),none,none,none,none,none
Can I add vanilla extract to simple syrup?,vanilla extract to simple syrup (1.00),none,none,none,none,none
How can you use a grill mat on an indoor grill?,grill mat on an indoor grill (1.00),none,none,none,none,none
Which dish do you default to when you have no ideas on what to cook?,none,none,none,dish (0.40),ideas (0.74),what (0.83)
How do you microwave pasta without drying it out?,pasta (1.00),none,none,drying it out (1.00),none,none
How do you make turkey meatballs that don't fall apart?,turkey meatballs that don't fall apart (1.00),none,none,none,none,none
What part of the human body would be more delicious if it has properly cooked with herbs and seasonings?,human body (0.75),delicious (0.58),none,properly (1.00),cooked with herbs and (0.87),seasonings (0.78)
How do I cook tender country ham slices?,tender country ham slices? (0.99),none,none,none,none,none
How can I make a casserole without chopping any of the ingredients?,casserole (1.00),any of the ingredients (0.97),none,chopping (0.93),none,none
"When making pancakes, what are some tricks to avoid the big mess and how to make them similar in size?",pancakes (1.00),tricks (0.56),mess (0.93),the (0.71),big (0.69),none
How long do you cook red potatoes?,red potatoes (1.00),none,none,none,none,none
What do you do if you mistake salt for sugar while cooking?,salt for sugar while cooking (1.00),none,none,none,none,none
What tips do you have on cutting vegetables lengthways before adding to a stew?,vegetables lengthways before adding to a stew (0.93),none,none,tips (0.87),none,none
"What can I use instead of carrots, onions, and celery when making a stew?","##s, onions, and celery when (0.92)",stew (1.00),none,carrot (0.80),none,none
"How do you slice, chop, and mince?","slice, chop, and mince (0.94)",none,none,none,none,none
How do I make rotisserie chicken less moist?,rotisserie chicken less moist? (1.00),none,none,none,none,none
"What is the difference between chicken bouillon, chicken stock and chicken broth?","chicken bouillon, chicken stock and chicken broth (1.00)",none,none,none,none,none
How do I make pizza not stick on a ceramic stone?,pizza not stick on a ceramic stone (1.00),none,none,none,none,none
What is chervil used for in cooking?,chervil (0.90),cooking (0.63),none,none,none,none
Which cooking oil is best for frying eggs?,frying eggs? (0.96),none,none,cooking oil (0.88),none,none
Can I pre-cook tri tip and finish it later?,tri tip and finish it later (1.00),none,none,none,none,none
What can you add to boiled food to make them taste better?,boiled food (1.00),them taste better (1.00),none,none,none,none
What is the best way to cook a rock eel?,rock eel? (0.94),none,none,none,none,none
How do I cook a cube steak without frying?,cube steak (1.00),none,none,fry (1.00),##ing (0.76),none
What is special about the chain cut off of the beef tenderloin? How do you like to cook it?,chain cut off of the beef tenderloin (1.00),it (0.44),none,none,none,none
How do you clean a pellet grill in an easy way?,pellet grill (1.00),easy way (1.00),none,none,none,none
How long does it take to BBQ a steak medium rare?,##q a (0.99),steak medium rare? (0.94),none,none,none,none
"Is there a way to cook minced garlic without it ""popping"" out of the pan?","minced garlic without it "" popping "" out of the pan (1.00)",none,none,none,none,none
What does ‘spatchcock’ mean in cooking?,spatchcock ’ (1.00),none,none,cooking (0.56),none,none
What foods do you feel are always better when cooked on a grill?,foods (0.71),when cooked on a grill (0.88),none,better (0.62),none,none
Can I stir fry potatoes without boiling them?,potatoes (1.00),none,none,boiling them (1.00),none,none
How do I make mustard greens taste good?,mustard greens taste good? (1.00),none,none,none,none,none
Can onions be grilled on a barbecue grill?,onions (1.00),grille (0.88),on (0.98),none,none,none
What is a fruit puree?,fruit puree (1.00),none,none,none,none,none
"After preheating an oven, am I supposed to bake at the same temperature or is it advisable to change?",oven (1.00),##ke (0.45),the same temperature (0.49),##hea (0.47),ba (0.67),ad (0.34)
What is the most versatile cooking device for people with limited space?,most (0.72),cooking (0.89),people (0.50),versatile (0.67),device (0.69),limited (1.00)
How long do you mix pizza dough in a spiral mixer?,pizza dough in a spiral mixer (1.00),none,none,none,none,none
"Is it true that if someone attempts to grill frozen brats and hamburgers on the grill without unthawing them first, they will most likely burn the outside but leave the inside uncooked?",frozen brats and hamburgers on the grill (1.00),them first (0.96),uncooked? (0.55),unthawing (0.97),outside (0.62),inside (0.82)
How long should I put microwave popcorn in for?,microwave popcorn in (1.00),none,none,none,none,none
What is a natural starter?,natural starter (1.00),none,none,none,none,none
How do I boil an egg without its shell getting cracked during boiling?,egg (1.00),none,none,its shell getting cracked during boiling (0.94),none,none
How do I broil steak in a gas oven?,steak in a (0.98),gas oven (0.98),none,none,none,none
How do I cook al pastor on a stove?,al pastor on a stove? (0.99),none,none,none,none,none
"Why do we need salt to ""pull"" the flavor of things we cook?","pull "" the flavor of things (0.98)",none,none,"salt to "" (0.85)",none,none
How do I make salty food less salty?,salty food less salty? (1.00),none,none,none,none,none
How could cooking be creative?,none,none,none,cooking (0.92),none,none
What kind of meals can you cook using tamarind powder?,meals (0.72),using tamarind powder? (1.00),none,none,none,none
How do you make the bottom of a frozen pizza crispy?,bottom (0.99),frozen pizza crispy? (1.00),none,none,none,none
How do I peel and chop an onion?,onion (1.00),none,none,none,none,none
What can a rice cooker cook beside rice?,rice cooker cook beside rice (0.98),none,none,none,none,none
"After searing, how long do you bake a 1-pound sirloin steak?",1 - pound sirloin steak (1.00),none,none,searing (0.71),none,none
How do you grill a burger without drying it out?,burger (1.00),none,none,drying it out (1.00),none,none
Can I make pancakes with just sweet potatoes and eggs?,pancakes with (1.00),none,none,just sweet potatoes and eggs (0.93),none,none
Why shouldn't you break the pasta before cooking it?,pasta (1.00),it (0.98),none,none,none,none
How long does it take to roast garlic in an oven?,garlic in an oven (0.94),none,none,none,none,none
How do you make salmon patties from scratch?,salmon patties (1.00),scratch (1.00),none,none,none,none
How do you cook pork loin chops?,pork loin chops? (1.00),none,none,none,none,none
How do I cook Denver steak in an oven?,denver steak in an oven? (0.92),none,none,none,none,none
How do I cook an angus steak in an oven?,angus steak in an oven (1.00),none,none,none,none,none
Can you cook sous vide directly with the store sealed packaging?,sous vide directly with the store sealed packaging (1.00),none,none,none,none,none
How can I make my shepherds pie taste better after already cooking the filling?,shepherds pie taste better (1.00),cooking the filling (1.00),none,already (0.68),none,none
How can I keep pizza from sticking to the pan?,pizza (1.00),sticking (0.64),pan (0.95),the (0.70),none,none
How long does it take to cook chicken at 325?,chicken at 325? (1.00),none,none,none,none,none
What's the best non-dairy way to neutralize spicy foods?,the best non - dairy way to neutralize spicy foods? (1.00),none,none,none,none,none
How can I safely dispose cooking oil that I used?,cooking oil that (0.99),none,none,none,none,none
What ingredient do you always add more than is called for in a recipe?,more than is called (0.69),in (0.56),none,ingredient (0.50),for (0.40),none
"How do I cook a ""one minute microwave pudding"" without a microwave?",""" one minute microwave pudding "" (1.00)",none,none,a (0.98),microwave (1.00),none
How do I make sure the inside is cooked when frying?,inside is cooked when frying (1.00),none,none,none,none,none
How long does it take to deep fry a ham?,ham (1.00),none,none,none,none,none
What are some substitutes for eggs in pancakes?,none,none,none,substitutes for eggs in pancakes (0.92),none,none
How can I boil eggs without the yolk turning green?,eggs (1.00),none,none,the yolk turning green (1.00),none,none
What's the best way to cook oat groats?,oat groats (1.00),none,none,none,none,none
What is the best bagged ice cream recipe?,the best bagged ice cream recipe (1.00),none,none,none,none,none
Is there any way at home that I can make flour tortillas without rolling them out?,flour tortillas (1.00),them out (0.98),none,rolling (1.00),none,none
"How do I achieve a ""simmer"" in an Instant Pot?",""" simmer "" in an instant pot (1.00)",none,none,none,none,none
"What can I cook for my mom on her birthday? I have no experience in cooking that's why I want it to be as easy as possible but also very special. I want to prepare a whole meal with the main dish, a side, accompanying drink and a dessert",mom (0.93),birthday (0.98),easy as possible (0.78),cooking (1.00),dessert (0.87),none
What will happen if the meat is not washed or rinsed before cooking?,meat (1.00),or rinsed before (0.77),none,washed (0.38),cooking (0.96),none
How long does it take to cook frittata in an oven?,frittata in an oven (1.00),none,none,none,none,none
"How do you make the bacon crispy, but not burn the scallops, for bacon wrapped scallops?","bacon crispy, but not burn the scallops, for bacon wrapped scallops (1.00)",none,none,none,none,none
How do you make chicken tenders juicy yet well cooked?,chicken tenders juicy yet well cooked? (1.00),none,none,none,none,none
How do I preserve pizza sauce for a year?,pizza sauce (1.00),none,none,none,none,none
How do I cook a 3 lb roast beef?,3 lb roast beef? (1.00),none,none,none,none,none
What are three ways to find the best olive oil for cooking?,the best olive oil for cooking (1.00),none,none,none,none,none
How do you reheat baked ziti in the oven?,reheat baked ziti in the oven (1.00),none,none,none,none,none
How do I cook perogies in the oven?,perogies in the oven (1.00),none,none,none,none,none
How do you prevent chicken from sticking when searing?,chicken from sticking when searing? (1.00),none,none,none,none,none
How do I cook a salmon fillet on the stove and what seasons should I use?,salmon fillet on the stove and (1.00),seasons (1.00),none,what (0.66),none,none
Do you need to cook vegetables before putting on pizza?,vegetables (1.00),none,none,pizza (0.89),none,none
Can you keep taco meat warm in a crockpot?,taco meat warm in a crockpot (1.00),none,none,none,none,none
How do I cook food in the forest?,food in the forest (0.87),none,none,none,none,none
What happens if you put too much bread crumbs in meatloaf?,too much bread crumbs in meatloaf? (1.00),none,none,none,none,none
What is the difference between carbonara and boscaiola?,carbonara and boscaiola (1.00),none,none,none,none,none
How do I make instant potatoes taste better?,instant potatoes taste better (1.00),none,none,none,none,none
What are your favorite seasonings or toppings you like to use when making roasted vegetables?,favorite seasonings or toppings (0.99),roasted vegetables (0.91),none,none,none,none
How do I cook brown rice on a stove?,brown rice on a stove? (0.96),none,none,none,none,none
What are awesome cooking hacks for fixing burnt food?,burnt food (0.82),none,none,hack (0.72),none,none
In how much water do I need to put ramekins when cooking au bain marie in the oven?,ramekins when cooking au bain marie in the oven (0.94),none,none,water (1.00),none,none
