utterance,dishname_first (score),dishname_second (score),dishname_third (score),ingredient_first (score),ingredient_second (score),ingredient_third (score)
How long does it take to bake a pizza at 400 degrees?,pizza at (1.00),degrees (1.00),none,400 (0.98),none,none
How do I cook chicken skewers in an oven?,chicken skewers in an oven (1.00),none,none,none,none,none
How do I make Chef Boyardee taste better?,chef boyardee taste better (1.00),none,none,none,none,none
What are some tasty ways to fix salty potato salad?,tasty (0.57),salty potato salad? (0.86),none,none,none,none
"Should you cook meat directly above the flame of a gas stove (grilling, cooking)?","meat directly above the flame of a gas stove ( grilling, cooking ) (1.00)",none,none,none,none,none
How do you soften carrots quickly?,soft (0.99),carrots quickly (0.99),none,none,none,none
How do I cook rice with coconut oil?,rice with coconut oil (1.00),none,none,none,none,none
Can I prepare my cake batter with a blender?,cake batter with a blender (1.00),none,none,none,none,none
How do you prevent a cake from rising and cracking in the middle while baking?,cake (1.00),and (0.74),in (0.43),rising (0.95),cracking (0.46),the (0.44)
What happens if you don't let pizza dough rise?,pizza dough rise (1.00),none,none,none,none,none
How do you make pasta salad with store-bought gnocchi?,pasta salad with store - bought gnocchi? (1.00),none,none,none,none,none
How do I replace eggs in a recipe?,eggs in (0.98),recipe (0.90),none,none,none,none
How do I make stir-fry sauces that don't get watery and thin as leftovers?,stir - fry sauces that don't get watery and thin as leftovers (1.00),none,none,none,none,none
Why would you add vinegar to a spaghetti sauce?,vinegar to (0.94),spaghetti sauce (1.00),none,none,none,none
Does egg temperature matter when making pancakes?,pancakes (1.00),none,none,egg temperature (1.00),none,none
What seasoning do you use to marinate chicken?,marinate chicken? (0.78),none,none,seasoning (0.99),none,none
What is a binding agent in cooking?,binding (0.88),cooking (0.63),none,agent (0.99),none,none
How do I know when my eggs are safely cooked?,eggs (1.00),safely cooked (0.94),none,none,none,none
Should I freeze dumplings raw or cooked?,dumplings raw or cooked (0.93),none,none,none,none,none
How long does it take to cook a beef pot roast?,beef pot roast (1.00),none,none,none,none,none
"What are tricks of the trade for cooking efficiently for one (food preservation, storage, shopping, cooking)?","efficiently for one ( food preservation, storage, shopping, cooking ) (0.99)",none,none,none,none,none
What do you do with leftover pancakes?,none,none,none,leftover pancakes (1.00),none,none
How do I keep Mac and cheese moist?,mac and cheese moist? (1.00),none,none,none,none,none
How can you keep a hamburger from bulging in the middle while it's cooking on the grill?,hamburger from bulging in the middle while it's cooking on the grill (1.00),none,none,none,none,none
What are the best pans to cook with and have food not stick to it or burn?,the best pans (0.97),with and have (0.81),not (0.84),food (0.58),stick (0.70),it (1.00)
What does scalded milk do for bread?,scalded milk (0.96),bread (0.53),none,none,none,none
What can you use instead of scalded milk in a recipe?,instead of scalded milk in a recipe (1.00),none,none,none,none,none
In a rice cooker do you add spices before or after cooking?,rice cooker (1.00),spices before or after cooking (0.93),none,none,none,none
Is slow cooking always the best way to cook brisket?,cooking (0.53),brisket (1.00),none,slow (0.87),none,none
Why is beating eggs with sugar necessary in some recipes?,eggs with sugar (0.90),recipes (0.98),none,beating (0.89),necessary (0.52),none
I would add BBQ powder on my fries but it won't stick to the fries. What do I do?,bbq powder (1.00),fries (1.00),it (0.67),the (0.77),none,none
How do you keep eggs from sticking to stainless steel pans?,eggs (1.00),sticking to stainless steel pans (0.98),none,none,none,none
What does 'blackened' mean in cooking? Does it mean this process will make the meat very well-done and dry?,meat very well - done and dry (0.78),none,none,' (0.66),blackened ' (0.83),cooking (0.54)
"When cooking steak, how can I keep the fat melting from causing the steak to change shape?",steak (1.00),fat (0.89),from causing (0.63),melting (0.68),none,none
Why shouldn't you peel potatoes when cutting onions?,potatoes when cutting onions (1.00),none,none,none,none,none
"What is the best way to cook hotdogs (that tastes decent), at home when you do not have access to a grill?","hotdogs ( that tastes decent ), (1.00)",none,none,grill (1.00),none,none
How do you stop boiled food from sticking to a stainless steel pot?,boiled food (1.00),sticking to (0.96),stainless steel pot (1.00),none,none,none
Why does my soufflé cheesecake sink so much? It sunk by about half within 5 minutes of taking it out of the oven.,souffle cheesecake sink (1.00),much? it sunk by about half within (0.73),minutes (0.63),none,none,none
How do you prevent your homemade potato salad from turning out watery?,homemade potato salad from turning out watery? (1.00),none,none,none,none,none
Is there a tool for searing/browning the sides of a chuck roast?,/ browning the sides of a chuck roast (0.99),none,none,searing (0.85),none,none
How do I cook linguica in the oven?,linguica in the oven (1.00),none,none,none,none,none
How long does it take to cook a small ham?,small ham? (0.93),none,none,none,none,none
What is the first thing you should always do before starting to cook?,none,none,none,none,none,none
"How do you soften hardened, freshly boiled pasta?",soft (1.00),"hardened, freshly boiled pasta? (0.99)",none,none,none,none
How do I cook chicken breast without oil?,chicken breast (1.00),none,none,oil (1.00),none,none
Can I cook a frozen pizza in a frying pan?,frozen pizza in a frying pan (1.00),none,none,none,none,none
What do you use instead of milk in meatloaf?,instead (0.50),milk in meatloaf? (0.99),none,none,none,none
How do I cook a steak on a stove?,steak on a stove (1.00),none,none,none,none,none
How do you grill without skewers?,without skewers? (1.00),none,none,none,none,none
How can I make my stew taste better? The tomatoes was almost spoilt and now the stew has a tangy taste,stew taste better (0.97),was almost spoilt (0.75),stew (0.55),tomatoes (0.67),tangy taste (0.87),none
How can I make an easy tofu marinade without sodium?,easy tofu marinade (1.00),none,none,sodium (1.00),none,none
My cookbook tells me to cook my eggs (4 of them) in a saucepan for 15 minutes for hard cooked eggs. How much time would I have to add to get good results for a dozen at a time?,eggs ( 4 of them ) in a saucepan for 15 minutes for hard cooked eggs (1.00),good results for a dozen (1.00),a (0.86),time (1.00),add (0.91),none
What do I do if my lasagna is too watery?,lasagna (1.00),watery (0.96),none,none,none,none
Can I add lentils to a baked chicken-and-vegetable stew?,lentils to (1.00),baked chicken - and - vegetable stew (1.00),none,none,none,none
Should I strip the factory seasoning off a new Lodge skillet?,factory seasoning off (1.00),new lodge skillet (0.98),none,none,none,none
How do you cook a 30 pound turkey?,30 pound turkey? (1.00),none,none,none,none,none
How do I make cream sauce for pasta?,cream sauce for pasta? (1.00),none,none,none,none,none
How do you rescue overproofed dough?,overproofed dough (1.00),none,none,none,none,none
Do ribs get more tender the longer they cook?,ribs (1.00),none,none,tender (1.00),none,none
"When cooking breakfast, what do you cook first?",breakfast (1.00),first? (0.95),none,none,none,none
"How do I make quick and easy fried chicken? What ingredients are required to make it juicy, crispy, and tender?",quick and easy fried chicken? (1.00),ingredients (0.66),"it juicy, crispy, and tender? (1.00)",none,none,none
How long do you cook penne pasta?,penne pasta? (0.98),none,none,none,none,none
What is your best recipe for a sour cherry pan sauce?,best (0.47),sour cherry pan sauce? (1.00),none,none,none,none
What is a good replacement for mayonnaise?,mayonnaise? (1.00),none,none,none,none,none
Do you need to wash scallops before cooking them?,scallops (1.00),them (1.00),none,none,none,none
What can I use instead of an oven?,oven (1.00),none,none,none,none,none
What is the best way to cook legumes?,legumes (1.00),none,none,none,none,none
What can you use as a binder in meatloaf instead of breadcrumbs?,binder in meatloaf instead of breadcrumbs (1.00),none,none,none,none,none
How hard is it to learn to cook?,none,none,none,none,none,none
"Are you supposed to cook pasta sauce before putting it on the pasta or, should you add pasta sauce directly from the jar and stir it up on the hot stovetop?",pasta sauce (1.00),it on the pasta or (1.00),pasta sauce directly from the jar (1.00),none,none,none
What trick does a professional chef do when he runs out of ingredients while cooking and the customer is waiting for him?,professional chef (1.00),he runs out of ingredients while cooking (1.00),the customer (0.83),none,none,none
How many efforts will be wasted in becoming a good cook?,good cook (1.00),none,none,efforts (0.78),none,none
What is the difference between a baked potato and a boiled potato?,baked potato and a boiled potato (0.96),none,none,none,none,none
"What's the attraction for bucatini pasta? It's hollow like a straw so you cannot slurp it as you would with spaghetti or twirl it with a fork unless you overcook it into mush. If you are going to chop it into segments, why not just use ziti?",bucatini pasta (1.00),it (0.99),hollow like a straw (0.88),sl (0.93),spaghetti (0.61),over (0.44)
How could you prepare a very tasty summer appetizer in just 5 minutes?,very tasty summer appetizer in just 5 minutes (1.00),none,none,none,none,none
Can you cook eggs without oil in a nonstick pan?,eggs without (0.82),in a nonstick pan (0.99),none,oil (1.00),none,none
How do you cook a boiled egg in which the egg white is cooked but the egg yolk is half-cooked and half liquid?,boiled egg in which the egg white is cooked but the egg yolk is half - cooked and half liquid (1.00),none,none,none,none,none
How long should I leave rice out after cooking?,rice out after cooking (1.00),none,none,none,none,none
How do you make tortilla chips?,tortilla chips (1.00),none,none,none,none,none
Do you have to defrost pizza before cooking?,pizza (0.88),none,none,defrost (0.88),cooking (0.94),none
"What's a foolproof way to prepare tofu where the cubes stay intact after cooking or baking, and don't break up?",foolproof (1.00),"tofu where the cubes stay intact after cooking or baking, (0.99)",none,break (0.94),up (0.61),none
How do you keep long noodles like fettuccine and spaghetti from breaking apart?,long noodles like fettuccine and spaghetti from breaking apart (1.00),none,none,none,none,none
How do I reheat leftovers in the oven?,leftovers in the oven (1.00),none,none,none,none,none
What does it mean to let a sauce reduce?,sauce reduce (1.00),none,none,none,none,none
What is the trick to making every single kernel pop when preparing popcorn?,single kernel pop when preparing popcorn (0.98),none,none,none,none,none
What is pernod in cooking?,##nod in cooking (0.74),none,none,per (0.93),none,none
How do you cook a pork soup without it tasting salty?,pork soup (1.00),? (0.41),none,it tasting salty (0.94),none,none
How long does it take to cook chicken breast at 400?,chicken breast at 400? (1.00),none,none,none,none,none
What is a free cooking book?,free cooking book (1.00),none,none,none,none,none
How do I make potato latkes?,potato latkes? (1.00),none,none,none,none,none
What would happen if you added a ton of Bay leaves to a soup?,ton of bay leaves to (1.00),soup (0.98),none,none,none,none
How do I cook moist boneless pork chops?,moist boneless pork chops? (1.00),none,none,none,none,none
Why do people pound chicken breasts flat before cooking?,chicken breasts flat before (0.98),none,none,cooking (0.85),none,none
How do you fix undercooked potatoes?,undercooked potatoes? (0.93),none,none,none,none,none
Do proteins disappear when boiling?,proteins (0.93),none,none,boiling (0.61),none,none
How do I flatten meat without a mallet?,meat (1.00),none,none,a (1.00),mallet (1.00),none
How do I spice up canned baked beans?,canned baked beans? (1.00),none,none,none,none,none
Is there a way to use or transform leftover hollandaise sauce?,leftover hollandaise sauce (0.96),none,none,none,none,none
Why do people use oil to cook popcorn when it cooks as well or better without using oil?,popcorn when it cooks as well or better (1.00),none,none,oil (1.00),using oil (0.98),none
How do I cook food more nutritiously?,food more nutritiously? (1.00),none,none,none,none,none
How do I cook a beef tip roast?,beef tip roast (1.00),none,none,none,none,none
Should you add garlic to pasta sauce?,garlic to pasta sauce (0.96),none,none,none,none,none
What are some tricks to prevent my omelettes from turning into scrambled eggs?,omelettes (0.97),turning into scrambled eggs (0.99),none,tricks (0.66),none,none
How do I strain Chia Seeds after soaking them? (they go right through my strainer as they are so small),chia seeds after soaking them? ( they (0.99),right (0.96),strainer (1.00),none,none,none
How long do you cook canned hominy?,canned hominy? (1.00),none,none,none,none,none
What is the best way to cook jowl bacon?,jowl bacon (1.00),none,none,none,none,none
How do you make fried food less greasy?,fried food less greasy? (1.00),none,none,none,none,none
How can I become a better chef?,none,none,none,none,none,none
How do I clean and cook a turkey?,turkey (1.00),none,none,none,none,none
How do I cook pork chops with bones?,pork chops with bones (1.00),none,none,none,none,none
How long does it take to cook chicken thighs in an oven at 180?,chicken thighs in an oven at (0.96),? (0.87),none,180 (0.92),none,none
How long does it take to cook small baked potatoes?,small baked potatoes? (1.00),none,none,none,none,none
Do you have to cook canned potatoes?,canned potatoes (1.00),none,none,none,none,none
How can I make my own Bisquick?,bisquick? (0.98),none,none,none,none,none
How much dry rice is needed to cook rice?,rice (1.00),none,none,dry rice (1.00),none,none
How do I make a tuna casserole in an oven?,tuna casserole in an oven (1.00),none,none,none,none,none
How long would you grill a full rack of ribs before flipping it over to season and cook the other side?,full rack of ribs before flipping it over to season (1.00),other side (0.99),none,none,none,none
Can you marinate chicken in buttermilk for 36 hours?,marina (0.95),chicken in buttermilk for 36 hours (1.00),none,none,none,none
What is the easiest way to cook perfect rice?,perfect rice? (1.00),none,none,none,none,none
How long do you bake chicken legs at 350?,chicken legs at 350? (1.00),none,none,none,none,none
Is it okay to season steak midway through cooking?,steak midway through cooking (0.98),none,none,season (0.47),none,none
"As so many dislike garlic presses, what are better methods to mince garlic?",dislike garlic presses (1.00),methods (0.90),##ce garlic (1.00),min (0.80),none,none
Why do chefs often put a wooden spoon across a pot of boiling water?,chefs (0.70),wooden spoon across a pot of boiling water (1.00),none,none,none,none
What are tips every griller should know for the grillings of fresh vegetables?,griller (1.00),grillings of fresh vegetables (0.95),none,tips (0.47),none,none
How do I cook mixed greens without meat?,mixed greens (1.00),none,none,meat (1.00),none,none
Does a burger cook better on a grill than a stove top?,burger (1.00),better on a grill than a stove top (0.96),none,none,none,none
What is the best tasting mushroom for cooking?,the best tasting mushroom (1.00),none,none,none,none,none
How do I make spaghetti in the microwave?,spaghetti in the microwave? (1.00),none,none,none,none,none
How long does it take to bake a 16 lb turkey?,16 lb turkey? (1.00),none,none,none,none,none
How long does gnocchi take to cook?,gnocchi (1.00),none,none,none,none,none
How could you prepare an excellent flan of potatoes and herbs?,excellent flan of potatoes and herbs? (0.99),none,none,none,none,none
"When cooking steak, should the fat inside be cooked?",steak (1.00),none,none,fat inside (0.69),cooked (0.56),none
What is the best way to reheat a cream based pasta dish?,##hea (0.62),cream based pasta dish (1.00),none,none,none,none
What are some good heat resistant bags for cooking?,good heat resistant bags (0.97),cooking (0.97),none,none,none,none
How long does it take to roast an unstuffed turkey?,unstuffed turkey (1.00),none,none,none,none,none
Is parchment paper better to cook with than foil?,with than foil (0.99),none,none,parchment paper (0.60),none,none
How do I cook mussels in red sauce?,mussels in red sauce (1.00),none,none,none,none,none
What are the advantages and disadvantages of sauteing?,advantages (0.91),##uteing (0.97),none,and disadvantage (0.52),sa (0.99),none
How do I cook a filet mignon medium well?,filet mignon medium well? (0.94),none,none,none,none,none
What cheese do you use in Cordon Bleu?,cordon bleu? (1.00),none,none,cheese (1.00),none,none
Is it better to cook wantons and then store them or store them in the fridge raw until they’re ready to cook?,wantons and then store them (0.89),them in the fridge raw until they ’ (0.87),cook (0.58),none,none,none
How do I cut the chicken into pieces to cook?,chicken into pieces (0.98),none,none,none,none,none
What is the best way to make my sourdough less sour?,sourdough less sour? (1.00),none,none,none,none,none
Is there a guaranteed way to crack an egg into a pan without breaking the yolk?,egg into a pan (1.00),none,none,breaking (1.00),the (0.87),yolk (0.96)
How do I cook calves liver and onions?,calves liver and onions? (1.00),none,none,none,none,none
How do I cook pasta without a pot?,pasta (1.00),none,none,a (1.00),pot (1.00),none
How do I chop a head of cabbage?,head of cabbage (1.00),none,none,none,none,none
How can you make a microwaved Caesar Salad taste good?,microwaved caesar salad taste good (1.00),none,none,none,none,none
Why is simmering important in making stocks?,stocks (0.83),none,none,simmering (0.97),none,none
Do you soak skewers in hot or cold water?,soak skewers in hot or cold water (0.98),none,none,none,none,none
How do I make tomato sauce with tomatoes?,tomato sauce with tomatoes? (1.00),none,none,none,none,none
How do you add smoke flavor to food cooked on a gas grill?,smoke flavor (1.00),food cooked on a gas grill (1.00),none,none,none,none
How do I thaw hash browns for a casserole?,tha (0.69),hash browns for a (0.90),casserole? (1.00),none,none,none
How does cooking time affect food?,food (0.94),none,none,cooking time (1.00),none,none
How do you fix Mac 'n Cheese That's too salty?,mac'n cheese that's too salty (1.00),none,none,none,none,none
How long does it take to cook a 10lb prime rib?,10lb prime rib? (1.00),none,none,none,none,none
"If you had to give either garlic or onion up in cooking, which one would it be?",garlic or onion up in cooking (1.00),one (0.41),none,none,none,none
What is the best way to check if bread dough is proofed?,bread dough is proofed (1.00),none,none,none,none,none
How do you make a weekend main dish with leftover last during the weekdays?,weekend main dish with leftover last during the weekdays (1.00),none,none,none,none,none
Do you have to soak toothpicks before baking?,so (0.48),toothpicks before baking (0.91),none,none,none,none
How many shrimps are 100g?,shrimps are 100g? (0.91),none,none,none,none,none
How do I make sauce out of tomatoes?,sauce out of tomatoes (1.00),none,none,none,none,none
How do I make all-purpose flour rise?,all - purpose flour rise? (1.00),none,none,none,none,none
Should eggs be at room temperature for pancakes?,eggs (0.96),room (0.76),pancakes (1.00),none,none,none
What is the benefit of soaking potatoes in water?,soaking potatoes in water (0.86),none,none,none,none,none
Do you add salt to an omelette?,salt (0.99),omelette (0.98),none,none,none,none
What spices would you put in roasted root vegetable soup purees?,roasted root vegetable soup purees (1.00),none,none,spices (0.97),none,none
How do I maintain oil temperature when deep frying at home?,oil temperature when deep frying (1.00),none,none,none,none,none
What can you do with overcooked simple syrup?,overcooked simple syrup (0.96),none,none,none,none,none
What is the best way to light up charcoal for barbecue?,charcoal for barbecue? (1.00),none,none,none,none,none
Why do people add ingredients to make their stew thick? What's wrong with runny stew?,stew thick? what's wrong with (0.92),##ny stew? (1.00),none,ingredients (0.99),run (1.00),none
How do I cook dried pinto beans fast?,dried pinto beans fast? (1.00),none,none,none,none,none
Are there any savory ideas (like for supper) for what you can do with bananas when their peels have gone brown?,##vory ideas ( like for supper ) for what you can do with bananas when their peels have gone (0.97),brown (0.43),none,sa (0.98),none,none
How do I use an easy bake ultimate oven?,easy bake ultimate oven (1.00),none,none,none,none,none
"When starting to cook, what should you practice and try to master first?",first (0.43),none,none,master (0.82),none,none
What can I do with leftover tomatoes?,none,none,none,leftover tomatoes (1.00),none,none
"When a recipe calls for partial ingredients, such as only the egg yolk, what are you supposed to do with the rest?",recipe (0.75),"partial ingredients, such as only the egg yolk (0.95)",none,rest (0.94),none,none
How do I make steamed broccoli taste good?,steamed broccoli taste good (1.00),none,none,none,none,none
How do I prepare a turkey before cooking?,turkey before cooking (1.00),none,none,none,none,none
Is it okay to bake chicken in its marinade?,chicken in its marinade (1.00),none,none,ba (0.79),none,none
How do I cook a 12 lb ham?,12 lb ham? (1.00),none,none,none,none,none
How can I prevent the breading from falling off my chicken as I prepare to cook it?,breading from falling off my chicken (0.96),none,none,none,none,none
How do I cook ham in a roaster?,ham in a roaster? (0.94),none,none,none,none,none
What are some tips for making a better sandwich?,better sandwich (1.00),none,none,none,none,none
What cannot be cooked in a steam oven?,steam oven (1.00),none,none,none,none,none
What are the pros and cons of stewing meat?,pros and cons of stewing meat (0.92),none,none,none,none,none
"Why do eggs stick to frying pans, no matter what material the pan is made of?",eggs (1.00),"frying pans, (0.98)",pan (0.98),material (0.99),none,none
Should you keep the skin on watermelon rinds when cooking?,skin on watermelon rinds when cooking (1.00),none,none,none,none,none
What’s your secret hack for boxed macaroni & cheese?,secret (0.99),boxed macaroni & cheese? (1.00),none,none,none,none
What's the best way to make a homemade mashed potato?,homemade mashed potato? (1.00),none,none,none,none,none
How do I know when a steak is done?,steak (1.00),done (0.99),none,none,none,none
What do spices mean for you for cooking? How do you usually dose?,none,none,none,spices (0.82),none,none
"One of the common problems in cooking starches is scorching, which resulted to starch granules settling in the bottom. How can we avoid this?","starches is scorching, which resulted (1.00)",##ch granules settling in (0.87),bottom (0.52),star (0.91),none,none
How long do you cook spaghetti sauce?,spaghetti sauce? (0.99),none,none,none,none,none
What is the best way to reheat breaded steak or pork?,reheat breaded steak or pork? (0.98),none,none,none,none,none
"If you have no cooking knowledge and experience and want to be able to cook professional-quality food for your future kids, should you go to culinary school?",professional - quality food (1.00),future kids (0.93),culinary school (0.85),cooking knowledge and experience (0.98),none,none
How do I make foods crispy and brown in the microwave?,foods crispy and brown in the microwave? (1.00),none,none,none,none,none
Is there any way to salvage soggy pasta?,soggy pasta (1.00),none,none,none,none,none
What happens if you cook with an unseasoned cast iron pan?,none,none,none,unseasoned cast iron pan (0.96),none,none
How do I thicken red beans and rice?,red beans and rice? (1.00),none,none,none,none,none
"I've been struggling for days to learn how to make rice pilaf, but I just can't get the hang of it. What is a good recipe or method to learn to make pilaf from scratch?",how to make rice pilaf (1.00),good (0.52),pilaf (1.00),scratch (0.95),none,none
How do I make a simple stir fry?,simple stir fry? (1.00),none,none,none,none,none
How do I spice up canned spaghetti sauce?,canned spaghetti sauce? (0.95),none,none,none,none,none
How long do you cook sea scallops?,sea scallops? (1.00),none,none,none,none,none
How do I make turkey gravy with giblets?,turkey gravy with giblets? (1.00),none,none,none,none,none
"What is velveting meat, and what are the benefits?",##ing meat (0.56),none,none,velvet (0.62),none,none
How do I steam salmon without a steamer?,salmon (1.00),none,none,steamer (1.00),none,none
How do you keep your nachos from getting soggy in the oven?,nachos from getting soggy in the oven (1.00),none,none,none,none,none
What is the best way to reheat cookies so they taste freshly baked?,reheat cookies so they taste freshly baked (0.96),none,none,none,none,none
How can I bake the food that is meant to fry?,food (1.00),meant (0.54),fry (0.67),none,none,none
"How would you get a person to eat your favorite dish, which contains an ingredient they don't like?","favorite dish, which contains an (0.95)",none,none,ingredient (0.83),none,none
How do I steam chicken in a rice cooker?,chicken in a (1.00),rice cooker (1.00),none,none,none,none
What should I bake on a Saturday?,saturday (0.99),none,none,none,none,none
