utterance,dishname_first (score),dishname_second (score),dishname_third (score),ingredient_first (score),ingredient_second (score),ingredient_third (score)
Are potato wedges fried or baked?,potato wedges fried or baked? (1.00),none,none,none,none,none
How is the perfect onion ring prepared according to the chef’s source?,perfect onion ring prepared according (1.00),the chef ’ s source (1.00),none,none,none,none
"What are some tricks to preserve the leftover pizza and bring it to the table the following day, always soft and fragrant as fresh from the oven?",leftover pizza (1.00),it (1.00),table (1.00),none,none,none
"Can you make minute rice the way you make risotto, or would that turn out weird?",minute rice the way (1.00),"risotto, (1.00)",weird (0.43),none,none,none
What recipes do you love that happen to rely on dry ingredients?,none,none,none,dry ingredients (1.00),none,none
What tools can I use from my kitchen to cook food on steam without a steamer?,food on steam (1.00),none,none,tools (0.36),a (0.97),steamer (1.00)
How do you thicken au jus? What are some tips?,thicken au jus? (1.00),? (0.90),none,tips (1.00),none,none
How do you fix undercooked rice in a rice cooker?,undercooked rice in a rice cooker (1.00),none,none,none,none,none
How is pizza sauce different from regular pasta sauce?,pizza sauce (1.00),from regular pasta sauce (1.00),none,none,none,none
"What is your tip or secret for keeping the ""hard shell"" on your tacos from breaking?",tip or secret (0.89),""" hard shell "" on your tacos from (0.99)",none,breaking (0.78),none,none
How much water do I put in my Zojirushi rice cooker?,zojirushi rice cooker (1.00),none,none,water (1.00),none,none
Is butter good for searing steak?,butter (0.66),searing steak (1.00),none,none,none,none
"What is the quickest, easiest way to remove the outer skin of an onion?","quickest, easiest (1.00)",the outer skin of (0.87),onion (1.00),none,none,none
Should you grill salmon with the skin-side down first?,salmon with the skin - side down first (0.99),none,none,none,none,none
How do I heat up a baked potato?,baked potato? (1.00),none,none,none,none,none
Why does my rice always taste watery when I cook it what am I doing wrong?,rice (0.98),it (0.62),none,watery (0.72),wrong (0.63),none
Why does it take so long to make pancake batter?,pancake batter (1.00),none,none,none,none,none
How do I make a zucchini wrapped sole recipe?,zucchini wrapped sole recipe (1.00),none,none,none,none,none
What are some ways to improve canned tomato soup to make it taste better?,canned tomato soup to make it taste better (1.00),none,none,none,none,none
How do you fix pulled pork that turned out dry? Will adding a ton of butter help?,pulled pork that turned out dry? (1.00),adding (0.36),ton of butter (0.90),none,none,none
How long does it take to cook a 9lb spiral ham?,9lb spiral ham? (1.00),none,none,none,none,none
What should you never do when cooking mushrooms?,mushrooms (1.00),none,none,none,none,none
How hot should oil be for frying?,frying (0.82),none,none,hot (0.27),oil (0.62),none
How do you can food with a pressure cooker?,none,none,none,pressure cooker (0.96),none,none
How do you keep chicken from burning on the grill?,chicken from burning on the grill (1.00),none,none,none,none,none
What is the best way to counteract vinegar if too much is put into soup?,##act vinegar if too much is put into soup (0.87),none,none,none,none,none
"What type of cooked pasta reheats best, egg-based or water-based?","cooked pasta reheats best, egg - based or water - based? (1.00)",none,none,none,none,none
How do I cook a bottom round rump roast?,bottom round rump roast? (0.98),none,none,none,none,none
How can I stop food from sticking to the bottom of the air fryer?,food (1.00),sticking (0.60),to (0.40),none,none,none
How do you saute shrimp in butter?,##ute shrimp in butter? (0.95),none,none,sa (0.70),none,none
What is the easiest pasta dish to prepare?,easiest pasta dish (0.99),none,none,none,none,none
How do you clean and cook asparagus?,asparagus? (1.00),none,none,none,none,none
Why is a 3/4 cups not common measurement cup in measurement sets?,3 / 4 cups not common measurement cup in measurement sets (1.00),none,none,none,none,none
How do I cook a rock cornish game hen?,rock cornish game hen? (0.99),none,none,none,none,none
How do I seal a jar with a jam so that it can be opened without breaking the lid?,jar (1.00),it (0.47),opened (0.42),jam (1.00),breaking (0.99),lid (0.86)
Why do you bring steak to room temperature before cooking?,steak (1.00),room temperature (0.99),none,cooking (0.97),none,none
How do you fry pork chops without them sticking to the pan?,pork chops (1.00),to (0.39),pan (1.00),them (1.00),sticking (0.71),the (0.98)
What is a panade in cooking?,panade in cooking (1.00),none,none,none,none,none
How do I cook and mash sweet potatoes?,and mash sweet potatoes? (1.00),none,none,none,none,none
What's the best lamb for roasting?,the best lamb for roasting? (1.00),none,none,none,none,none
What does it mean to cook a steak blue?,steak blue? (1.00),none,none,none,none,none
How do I cook without oil or butter?,without oil or butter? (1.00),none,none,none,none,none
Why does my brown rice always turn out hard?,brown rice always turn out hard (0.88),none,none,none,none,none
"What are some easy, quick, and low-budget recipes?","easy, quick, and low - budget recipes (1.00)",none,none,none,none,none
"What is the best way to tenderize a steak, without making a career out of it?","steak, (1.00)",career out (0.78),none,making (0.92),it (0.81),none
What’s are some of your favourite summer gathering recipes?,favourite summer gathering recipes (1.00),none,none,none,none,none
How do you keep bacon from curling up while you cook it?,bacon from curling up (0.93),it (0.93),none,none,none,none
How do I fry French fries at home?,french fries (1.00),none,none,none,none,none
How do you toast pecans on the stove?,pecans on the stove (1.00),none,none,none,none,none
How do you keep the crust of a frozen pizza from burning?,crust (1.00),frozen pizza from (0.95),none,burning (0.98),none,none
How can I replace peanut butter in a recipe?,peanut butter in (1.00),recipe (0.99),none,none,none,none
How do you make scampi sauce?,scampi sauce? (0.93),none,none,none,none,none
How could you roast eggplants without having a grill?,eggplants (1.00),? (0.92),none,grill (1.00),none,none
What are the advantages of stir frying?,stir frying (1.00),none,none,none,none,none
Can you grate an onion?,onion (1.00),none,none,none,none,none
What kind of fuel should I use in a fondue burner?,fondue burner (1.00),none,none,fuel (0.99),none,none
What are the most common blunders in home cooking?,most (0.57),blu (0.56),home cooking (0.66),common (0.46),##nders (0.91),none
Are store-bought tortillas fully cooked?,store - bought tortillas fully cooked? (0.99),none,none,none,none,none
How do I fix soggy fried rice?,soggy fried rice (1.00),none,none,none,none,none
How do I cook zucchini on a stove top?,zucchini on a stove top (1.00),none,none,none,none,none
How do I cook a boneless top sirloin steak?,boneless top sirloin steak? (1.00),none,none,none,none,none
How do you choose and cook your pasta so that it sticks well to the sauce?,pasta (1.00),it sticks well to the sauce (0.72),none,none,none,none
How hot do you cook a turkey?,turkey (1.00),none,none,none,none,none
How do I make canned chicken taste good?,canned chicken taste good? (1.00),none,none,none,none,none
How do I cook a bone in an oven?,bone in an oven (1.00),none,none,none,none,none
How do I cook a turkey with cheesecloth?,turkey with cheesecloth? (1.00),none,none,none,none,none
Does marinating steak make it more tender?,tender (0.58),none,none,marinating steak (1.00),none,none
How do I cook a 5lb beef tenderloin?,5lb beef tenderloin? (1.00),none,none,none,none,none
Do you have to soak rice noodles before cooking?,so (0.73),rice noodles (1.00),cooking (0.53),none,none,none
What is a nice alternative to pancetta when preparing carbonara?,pancetta when preparing carbonara? (1.00),none,none,none,none,none
What is the best way to grill ahi tuna?,ahi tuna? (0.99),none,none,none,none,none
"What is the best way to prepare hotdogs? Boiled, fried or microwaved?","hotdogs? boiled, fried or microwaved? (1.00)",none,none,none,none,none
What are some of the best ways to elevate a simple dish up to another level?,the best (1.00),eleva (0.80),simple dish up (1.00),none,none,none
What are some good tips for an oven that is too hot at the bottom?,oven (1.00),is too hot at the bottom (0.90),none,good (0.99),none,none
How do I cook pheasant on the stove?,pheasant on the stove (1.00),none,none,none,none,none
How can you fix a cast iron pan that becomes sticky after cooking?,cast iron pan that becomes sticky after cooking (1.00),none,none,none,none,none
What ingredients do you use for cooking bacon?,bacon (1.00),none,none,ingredients (0.97),none,none
How do I make a giant chicken nugget?,giant chicken nugget? (1.00),none,none,none,none,none
How could you fry food without always using oil?,food (1.00),none,none,always using oil (1.00),none,none
How do I cut an eggplant for eggplant parmesan?,eggplant for eggplant parmesan? (0.97),none,none,none,none,none
How long does it take to cook asparagus at 450?,asparagus at 450? (1.00),none,none,none,none,none
Why do baking recipes call for unsalted butter?,baking recipes (0.89),unsalted butter (1.00),none,none,none,none
How do I make popcorn like in the movies?,popcorn like in the movies (1.00),none,none,none,none,none
How do I safely make cold cut deli meat?,cold cut deli meat (1.00),none,none,none,none,none
"I love baking and cooking, but I can't bake or cook anything. I can't even make a doughnut. What do I do?",bake or cook anything (0.83),doughnut (1.00),none,baking (1.00),cooking (0.83),none
What happens to your rice if you leave it in the rice cooker on warm mode?,rice (0.99),it in the rice cooker on warm mode (0.93),none,none,none,none
How do you cook bacon and eggs in the same pan?,bacon and eggs in the same pan (1.00),none,none,none,none,none
Can you use the oven and stove at the same time?,oven and (0.96),none,none,stove (0.52),none,none
What would be a good non-dairy butter substitute for preparing a steak?,good non - dairy butter substitute for (1.00),steak (0.99),none,none,none,none
How do you crush grains at home?,grains (0.97),none,none,none,none,none
Have you ever cooked the eggplant like this? I can never stop cooking eggplant.,eggplant (1.00),this (0.80),eggplant (0.98),none,none,none
"What kind of meat should be used for fondue, and why?","fondue, and why (0.84)",none,none,meat (0.96),none,none
Can you grill and barbecue when it is raining outside?,when it (0.67),raining outside (0.85),none,none,none,none
How would you prepare the fastest and tastiest summer meal in a few minutes?,the fastest and tastiest summer meal (1.00),a few minutes (1.00),none,none,none,none
Do you use the same amount of pure vanilla as vanilla extract?,pure vanilla as vanilla extract (1.00),none,none,none,none,none
"Do you have to peel potatoes for a soup? E.g. Scotch Broth. When I bake potatoes I leave the skin on, that's the best bit isn't it?",potatoes for (1.00),soup? e. g. scotch broth. (1.00),bake potatoes i (0.97),skin (0.83),none,none
Has anyone ever tried heating or reheating food in a microwave using cooking oil?,or reheating food in a microwave using cooking oil (0.98),none,none,heating (0.99),none,none
Should I blanch vegetables before roasting?,vegetables before roasting (0.99),none,none,none,none,none
How large in diameter should one’s frying pan be for stir fry?,diameter (0.64),one ’ s frying pan (1.00),for stir fry (0.94),none,none,none
What are your techniques in cooking eggs to be delicious?,eggs to be delicious (1.00),none,none,none,none,none
What are some simple cooking tips that can make a quick and easy dish taste better?,quick and easy dish taste better (1.00),none,none,simple cooking tips (0.89),none,none
How can you incorporate leftover broccoli into other recipes?,leftover broccoli into other recipes (1.00),none,none,none,none,none
Is it worth getting canned whole tomatoes to then immersion blend them?,canned whole tomatoes to then immersion blend them (1.00),none,none,none,none,none
What if a recipe calls for two eggs but you have only one?,two eggs (1.00),none,none,one (0.99),none,none
How do you make blueberry pie filling from scratch?,blueberry pie filling from scratch? (0.97),none,none,none,none,none
How do I cook a 20 lb ham?,20 lb ham? (1.00),none,none,none,none,none
How do I bake a tri-tip roast?,tri - tip roast (1.00),none,none,none,none,none
"Is it really necessary to soak the potatoes in water, before putting them in the oven/pan?","potatoes in water, (1.00)",them (0.71),oven / pan (0.99),none,none,none
"When trying to sear a steak on the pan, is it best to have the pan as hot as possible before putting the steak on or cold?",steak on the pan (1.00),pan as hot as possible (0.86),steak (0.96),or (0.50),none,none
How do I avoid splatter when cooking with oil?,splatter when cooking with oil (1.00),none,none,none,none,none
What's the best method for removing fat off a whole chicken?,best (0.45),fat off a whole chicken? (0.99),none,none,none,none
How long should dry beans be soaked before cooking?,dry beans (1.00),soaked before (0.58),none,cooking (0.81),none,none
How many cloves of garlic should you use for one portion of pasta sauce?,cloves of garlic (1.00),one portion of pasta sauce (1.00),none,none,none,none
How do I cook a country cured ham?,country cured ham? (1.00),none,none,none,none,none
Can I use pasta sauce instead of tomato sauce?,pasta sauce instead of tomato sauce (1.00),none,none,none,none,none
How do I cook a petite tender beef filet?,petite tender beef filet? (1.00),none,none,none,none,none
How can you fix it when you overproof your pizza dough?,overproof your pizza dough (0.99),none,none,none,none,none
What is the best way to fix Yukon Gold potatoes?,yukon gold potatoes (1.00),none,none,none,none,none
How do I cook garlic in the microwave?,garlic in the microwave? (1.00),none,none,none,none,none
When I don't have an egg tray or egg carton how to carry eggs without breaking them?,egg tray or egg carton how to carry eggs (1.00),them (0.77),none,breaking (1.00),none,none
What is the most practical way to steam rice?,rice (1.00),none,none,none,none,none
What is the most difficult way to cook an egg?,egg (1.00),none,none,none,none,none
Is it okay to let the chicken marinate for 15-20 minutes before cooking?,chicken marinate for 15 - 20 minutes (1.00),none,none,cooking (0.85),none,none
Is dry ginger an option for fresh ginger in recipes?,ginger (1.00),fresh ginger in recipes (1.00),none,dry (0.86),none,none
What do you call foods cooked in a frying pan?,foods cooked in a frying pan (1.00),none,none,none,none,none
What is the best way to not have dough stick to your hands as you’re kneading it?,dough stick to (0.71),hands as (0.91),knead (0.98),none,none,none
Help! I forgot to put onions in my meatloaf. Meatloaf is already done so I cut it in half and stuffed raw onions in it. How long before onions are cooked on 375 in oven without overcooking meatloaf?,onions in my meatloaf. meatloaf is already done (1.00),it in half (0.80),stuffed raw onions in it (0.88),over (1.00),##ng (0.92),none
"Why should you gently fry/infuse your olive oil with garlic (or lime zest/salt etc.) and not the meat directly that you're pan-frying (cooking, technique, flavor, aroma, food science)?",fry (0.95),infus (0.99),olive oil with garlic ( or lime zest / salt etc. ) and (1.00),meat (1.00),none,none
What are some uncomplicated ingredients that can really make a boring dish tasty?,can really make (0.89),boring dish tasty (0.97),none,uncomplicated ingredients that (0.95),none,none
"What's a good, lightweight solution for portable cookware?","good, lightweight solution (1.00)",portable cookware (1.00),none,none,none,none
How long does steak last after being cooked?,steak (1.00),cooked (0.45),none,none,none,none
How do I cook a sirloin steak medium rare?,sirloin steak medium rare? (1.00),none,none,none,none,none
What can you cook in a multicooker?,multicooker (1.00),none,none,none,none,none
Why does ground beef get tougher the more it’s handled prior to cooking?,ground beef (1.00),##er the more it ’ s handled prior (0.93),none,tough (0.66),cooking (0.96),none
What is the difference between broiling and braising?,broiling and braising (1.00),none,none,none,none,none
Does a roasting pan have to have a lid to cook a large stuffed turkey properly?,roasting pan (1.00),large stuffed turkey properly (1.00),none,lid (1.00),none,none
Can you leave pizza dough to rise for hours?,pizza dough (1.00),rise for hours (0.99),none,none,none,none
How do I cook a 6-pound chicken?,6 - pound chicken? (1.00),none,none,none,none,none
What ingredients can be added to pasta dough to give it more flavor?,pasta dough (1.00),it (0.97),none,ingredients (0.99),flavor (0.49),none
What's your cooking tip that sounds gross but is actually amazing?,cooking tip that sounds gross but is actually amazing (0.98),none,none,none,none,none
What can you add to make your oatmeal tastier?,oatmeal tastier (1.00),none,none,none,none,none
How long do you cook string beans?,string beans? (1.00),none,none,none,none,none
How long does it take to cook pork at 350?,pork at 350? (1.00),none,none,none,none,none
What is the best way to clean a roasting tray/baking tray that has sauce burned onto it?,roasting tray / baking tray that has (1.00),burned onto (0.89),none,sauce (0.98),none,none
How do I cook a pork blade roast?,pork blade roast (1.00),none,none,none,none,none
"When you cook, do you often spice up your preparations? If so, what kind?",preparations (0.83),so (0.40),none,kind (0.34),none,none
"Can popcorn be made out of any kind of corn? If so, why don't we do that more often?",popcorn (1.00),made out of any kind of corn (0.99),often (0.55),none,none,none
"As a cooking enthusiast, what is one thing you absolutely could not do without in the kitchen?",cooking (1.00),absolutely could not (0.45),none,in (0.96),kitchen (0.63),none
With what do you balance a dish that turned out more spicy than you planned?,dish (1.00),out more spicy than (0.74),none,turned (0.98),none,none
How do I boil eggs to make them easy to peel?,eggs (1.00),them (0.99),easy to peel (0.91),none,none,none
What do you add to powdered gravy to make it better?,powdered gravy to (1.00),it better (0.98),none,none,none,none
Does the way you prepare garlic impact its flavor?,garlic impact its flavor (1.00),none,none,none,none,none
How long does it take to cook oatmeal in a microwave?,oatmeal in a microwave (1.00),none,none,none,none,none
How do you soften tough corned beef?,soft (1.00),tough corned beef (1.00),none,none,none,none
How can I make ham taste more interesting? The hams I cooked are usually very plain.,ham taste more interesting (1.00),hams (0.96),none,plain (0.62),none,none
How often do you cook a slow stew?,slow stew (1.00),none,none,none,none,none
How long does it take to reheat pasta in a microwave?,reheat pasta in a microwave (0.94),none,none,none,none,none
Can rice be cooked in a pressure cooker?,rice (0.99),pressure cooker (1.00),none,none,none,none
Is there any benefit of sous vide in butter?,vide in butter (0.93),none,none,sous (0.73),none,none
How do I cook a tender chicken breast?,tender chicken breast? (1.00),none,none,none,none,none
How do I cook tamales on the stove?,tamales on the stove (1.00),none,none,none,none,none
How long do you soak kidney beans?,kidney beans? (1.00),none,none,none,none,none
How much uncooked rice makes 1 cup cooked?,1 cup cooked? (1.00),none,none,uncooked rice makes (0.87),none,none
How do I cook a pork Boston butt steak?,pork boston butt steak? (1.00),none,none,none,none,none
Can pizza dough be made in advance?,pizza dough (1.00),made in advance (0.86),none,none,none,none
What are the advantages of brining a turkey?,turkey (1.00),none,none,br (0.95),none,none
How do I make Mac and cheese cheesier?,mac and cheese cheesier? (1.00),none,none,none,none,none
What did you cook last week?,last week (0.88),none,none,none,none,none
What cheap nice food can I cook on a budget?,cheap nice food (1.00),none,none,none,none,none
What can I do to drain my vegetables from the oil that I used too much of?,vegetables from the oil that (1.00),used (0.77),much of (0.70),none,none,none
How do I cook cabbage in a pot?,cabbage in a pot? (0.96),none,none,none,none,none
What are the best stocks you can use while cooking lamb?,lamb (0.99),none,none,best stocks (0.81),none,none
How long should a rub stay on meat before cooking?,rub stay on (1.00),meat before (0.84),none,cooking (0.76),none,none
How long does it take to cook uncooked chicken tenders?,uncooked chicken tenders (1.00),none,none,none,none,none
How do I cook chicken on a traeger?,chicken on a traeger? (1.00),none,none,none,none,none
How long do you let charcoal burn before cooking?,charcoal burn before cooking (0.98),none,none,none,none,none
How do I use a power pressure cooker?,power pressure cooker (1.00),none,none,none,none,none
How do I make my homemade yogurt less sour?,homemade yogurt less sour? (1.00),none,none,none,none,none
How do you cook steak fajitas without the meat being too tough?,steak fajitas (1.00),none,none,the (1.00),meat being (0.75),tough (0.95)
Why is it important to cut vegetables into a uniform size before cooking?,vegetables into a uniform size (0.94),none,none,cooking (1.00),none,none
How do I cook on a cast iron griddle?,cast iron griddle? (1.00),none,none,none,none,none
Is steak better if cooked in a stone/wood fired oven?,steak (0.80),cooked (0.78),stone / wood fired oven (1.00),none,none,none
How do I thicken pasta sauce without cornstarch?,thick (0.74),pasta sauce (0.93),none,cornstarch (1.00),none,none
How do you cook spinach without losing nutrients?,spinach (1.00),nutrients (1.00),none,losing (1.00),none,none
"Can you slow roast a Strip Steak to make it more tender? Our grocers meats are pretty bad, tasteless and tough. I've tried Sous Vide, reverse sear, brining and roasting . . . looking for the roasting trick to work.",strip steak (1.00),it more tender (1.00),our grocers meats (1.00),none,none,none
Can I use any chili paste as a substitute for sambal?,chili paste (1.00),sambal (0.98),none,none,none,none
How could you prepare an appetizing bruschetta in a few minutes?,appetizing bruschetta (1.00),a few minutes (0.91),none,none,none,none
What is your favorite ketchup recipe and/or unique recipe item for your ketchup?,favorite ketchup recipe and / or unique recipe item for (0.97),ketchup (1.00),none,none,none,none
Do different cooking methods affect meat taste?,meat taste (0.71),none,none,cooking methods (0.91),none,none
How long do you cook a medium rare steak on the stovetop?,medium rare steak on the stovetop (1.00),none,none,none,none,none
What are some safety precautions for cooking?,cooking (0.62),none,none,safety precautions (0.99),none,none
Can ragù be used for dishes that don't contain pasta?,dishes (1.00),none,none,ragu (0.99),pasta (1.00),none
How do I cook a pork shoulder roast?,pork shoulder roast? (0.92),none,none,none,none,none
What are the mistakes not to make because they would spoil the clams before cooking?,mistakes (0.84),because they would spoil the clams before (0.81),none,cooking (0.90),none,none
How long does it take to pressure cook a pork roast?,pork roast (1.00),none,none,none,none,none
How do you make bacon not crispy?,bacon not crispy? (1.00),none,none,none,none,none
How do I prepare steak on the stove?,steak on the stove (1.00),none,none,none,none,none
Can You cook sardines (canned) in many ways?,sardines ( canned ) in many ways (1.00),none,none,none,none,none
What is the best technique to ensure pan-fried sandwiches (e.g. a reuben) does not fall apart when you flip it?,pan - fried sandwiches ( e. g. a reuben ) does not fall apart when (1.00),it (0.85),none,none,none,none
How much rice should I cook for 4?,for 4? (1.00),none,none,rice (1.00),none,none
How do I slice cheese without a slicer?,cheese (1.00),none,none,a (0.99),slicer (1.00),none
What is bain marie in cooking? What benefits does it have for food?,bain marie (0.73),it (0.43),none,cooking (0.60),benefits (0.50),food (1.00)
I've put too much mustard in my potato salad. Do you have a remedy so I can salvage my dish?,mustard in my potato salad (0.90),dish (0.88),none,remedy (0.99),none,none
What will happen to my cake if I don't preheat the oven?,cake (1.00),the (0.40),none,pre (0.47),##hea (0.48),oven (0.44)
How do I cook white rice in an instant pot?,white rice in an instant pot? (0.97),none,none,none,none,none
Are woks practical for cooking for a family?,wo (0.54),family (0.99),none,##ks (0.70),none,none
Does steak from a supermarket cook quicker than steak from butchers?,steak from (1.00),supermarket (0.91),quicker than steak from butchers? (0.95),none,none,none
What are some tips for searing a steak?,steak (1.00),none,none,none,none,none
Are popcorn kernels edible?,popcorn kernels (1.00),none,none,none,none,none
What are some recipes for cooking corn on the cob?,corn on the cob? (1.00),none,none,none,none,none
How do I broil lamb chops in an oven?,lamb chops in an oven (0.99),none,none,bro (0.58),none,none
What are some easy tricks to prolong the life of your grill?,prolong (0.51),life (0.98),grill (0.81),easy tricks (0.93),none,none
Is it worth it to buy more expensive eggs?,more expensive eggs (0.94),none,none,none,none,none
How do I cook poached eggs without it sticking to the pan?,poached eggs (1.00),sticking to the pan (0.82),none,it (1.00),none,none
What's the recipe for a tempura worthy of the name?,tempura worthy of the name (1.00),none,none,none,none,none
How do you make cabbage interesting?,cabbage interesting? (1.00),none,none,none,none,none
