utterance,dishname_first (score),dishname_second (score),dishname_third (score),ingredient_first (score),ingredient_second (score),ingredient_third (score)
What vegetable do you hate that everyone loves?,everyone (0.37),none,none,vegetable (0.56),none,none
What happens if we eat papaya during periods?,papaya during periods (1.00),none,none,none,none,none
"If I attend a black family’s cookout, what type of food should I expect to be served?",black family ’ s cookout (1.00),food (1.00),served (0.48),none,none,none
Why do most cheap foods that taste good also end up being really unhealthy?,cheap foods (0.98),taste (0.48),also (0.94),good (0.46),unhealthy (0.51),none
Why does everything I eat taste like vomit? I have been trying to eat food all day and nothing tastes good.,food (1.00),day (0.40),none,vomit (0.89),nothing (0.87),good (0.96)
"Your father says he's going to grab some milk, it's been 15 years and he actually returns home with the milk. What do you say/do?",milk (1.00),it (1.00),been 15 years (0.73),milk (0.98),/ (0.52),none
What is the best technique to ensure pan-fried sandwiches (e.g. a reuben) does not fall apart when you flip it?,pan - fried sandwiches ( e. g. a reuben ) does not fall apart when (1.00),it (0.85),none,none,none,none
"I had a Chinese takeaway last night, but today made from scratch a beef mince and vegetable puff pastry pie. Is it because of Brexit? Or, just a crazy thought, but might some things not be because of Brexit, good or bad, and might've been anyway?",chinese takeaway (1.00),made from scratch a beef mince and vegetable puff pastry pie (1.00),crazy thought (0.96),brexit (0.97),brexit (0.99),none
"I’m 14 and I’m a very picky eater, I don’t eat any vegetables or any meat that is partly done. I’ve also had traumatic memories with veggies when I was little. How can I bring myself to try new foods?",very picky eater (0.98),vegetables or any (0.54),foods (0.95),meat that (0.56),partly (0.87),done (0.95)
Are McDonald's apple pies really made out of potatoes and high-fructose corn syrup?,mcdonald's apple pies really made out of potatoes and high - fructose corn syrup (1.00),none,none,none,none,none
I’m 19. How do I fake being ill so I can go to the hospital just to eat their free food? I don’t get food at home. My dad never buys me any.,ill (0.65),hospital (0.83),free food (0.98),food (1.00),none,none
"My cat won't move; not even to eat or drink. She is still breathing, and conscious, and cries sometimes. She's old, but has seemed healthy before. What is wrong with her?",cat (0.98),move (0.47),or drink (0.52),", (0.36)",seemed (0.34),none
"I stopped eating and completely lost my appetite and don’t feel hungry anymore, and recently my body parts have been shaking for no reason at all and I feel really weak. Why? I am a teen.",body (0.63),shaking (0.40),none,appetite (0.47),hungry anymore (0.73),parts (0.63)
Does Chicago-style pizza exist in Italy?,chicago - style pizza (1.00),italy (0.69),none,none,none,none
"If humans don't need meat to survive, why did we choose to eat meat for thousands of years?",humans (0.57),meat for thousands (0.62),years (0.33),meat (1.00),none,none
Are people working at fast food restaurants allowed to eat from the food stations present there? Who doesn't fancy free food right?,fast food restaurants allowed (1.00),eat from the food stations present there (1.00),who doesn't fancy free food right (1.00),none,none,none
"You have to invite your neighbors over for dinner. Either the ones to the left of you, right of you or directly across from you. Who do you invite and why?",neighbors (0.86),dinner (0.62),ones (0.56),directly (0.29),none,none
What should vegans avoid?,vega (0.98),none,none,none,none,none
Is cheese still edible if left out of the fridge overnight?,cheese (0.99),edible if left out of the fridge overnight (0.87),none,none,none,none
"Is it true that Italians always take the garlic out when cooking, whereas the French keep it in the food and eat it? What explains this difference?",italians (0.96),garlic out when cooking (1.00),french (0.90),it (0.58),difference (0.52),none
Can I make some cookies?,cookies (1.00),none,none,none,none,none
What are the best fish for making sushi?,sushi? (1.00),none,none,none,none,none
"I can eat natural cow milk, yogurt, sweet, chocolate, and ice cream without any problems, but eating cheese hurts my stomach. What are the problems? This should not happen as cheese contains less lactose.","natural cow milk, yogurt, sweet, chocolate, and ice cream (1.00)",cheese (0.72),problems (0.46),any (1.00),problems (1.00),lac (0.96)
"If relationship tastes like a drink, what does yours taste like?",relationship (0.79),drink (0.99),none,yours (0.90),none,none
"As a waiter or waitress, what's the strangest combination of main and side order that you've ever seen a customer order?",waiter or waitress (0.71),strangest combination of main and side order that (0.99),ever (0.48),none,none,none
Why do some children not like sweets/sugar?,children (1.00),sugar? (0.76),none,sweets / (0.97),none,none
I've never gotten high from edibles. Should I eat a whole 500mg edible?,from edibles (0.91),whole 500mg edible (1.00),none,none,none,none
How does stuff get out of my lungs? For example when a piece of food or water goes down the wrong way?,lungs (0.41),piece (0.93),food or water goes down the (0.75),stuff (0.69),none,none
Why does whole milk give me diarrhea but not others?,milk (0.79),diarrhea but not others (0.90),none,whole (0.86),none,none
"My mom is too busy to feed me. She always pushes me off and leaves me to cook my own food, but I'm only 12. I haven't ate anything today because there's no food here either. What do I do?",food (0.94),anything (0.81),none,food here either (0.89),none,none
Is there a certain stage of banana that we should eat eat for workout?,that (0.61),eat for workout (0.84),none,banana (0.84),none,none
How do you discipline a dog who eats his food bowls?,dog (1.00),eats his food bowls (1.00),none,none,none,none
"When a recipe calls for a teaspoon or a tablespoon of something, is the default a level or heaping one if not specified?",recipe (0.92),teaspoon or a tablespoon of something (1.00),level or heaping one (1.00),default (0.54),specified (0.91),none
What can you cook on an outdoor griddle?,outdoor griddle (1.00),none,none,none,none,none
Is it true that part of the Markle problem was her total lack of British table etiquette and an inability to use a knife and fork in the European manner?,markle problem (1.00),table et (0.97),##tte (0.67),british (1.00),##ique (0.61),none
"If a religion prohibits eating pork, what happens if a child who is brought up with this religion eats pork? What are the ramifications? How strict is this rule?",religion (0.85),pork (0.96),child (0.98),religion (0.41),pork (0.96),ramification (0.85)
How many 15 oz cans make a pound?,pound? (0.98),none,none,15 oz cans (0.98),none,none
Would you put ice cream on top of a hamburger?,ice cream on top of (1.00),hamburger (1.00),none,none,none,none
What kind of sausage patty does McDonald’s use?,sausage patty (1.00),mcdonald ’ s use (0.99),none,none,none,none
Why do eggs sometime give you a nauseous feeling after eating?,sometime (0.99),nauseous feeling after (0.99),none,eggs (0.94),eating (0.97),none
What is the hardest diet in the world?,hardest (0.85),none,none,none,none,none
"Malaysian food: What are the differences among Mee Rebus, Mee Jawa and Mee Rojak Mamak?",malaysian food : (0.78),"mee rebus, mee jawa and mee rojak mamak? (1.00)",none,none,none,none
"Every day, I typically eat 6 oz of salmon, 4-6 veggie meatballs, and 6oz of blueberries. Am I consuming too many calories?","6 oz of salmon, 4 - 6 veggie meatballs, and 6oz of blueberries (1.00)",many calories? (1.00),none,none,none,none
Do you feed your cat milk?,cat milk (1.00),none,none,none,none,none
Is Australian Wagyu as good as Japanese Wagyu?,australian wagyu (0.99),good as japanese wagyu? (0.97),none,none,none,none
Which is the food that is stolen the most?,food (0.86),stolen (0.38),the (0.31),none,none,none
"A simple ""Yes"" or ""No"" question. Can you get diabetes from honey?","simple "" yes "" or "" no "" question (1.00)",diabetes from honey (0.99),none,none,none,none
What alcohol is good with fried chicken?,none,none,none,alcohol (0.32),fried chicken? (1.00),none
How long should a person wait after a meal to take fruits?,person (0.50),meal (1.00),none,fruits (0.96),none,none
"Why does water taste so good, even though it tastes like nothing?",water (0.77),good (0.33),it (0.45),nothing (0.96),none,none
My cat ate a crumb (about a gram) of chocolate that I accidentally left out and ate it. Will she be okay?,cat (0.71),crumb ( about a gram ) of chocolate that (1.00),accidentally left out (1.00),none,none,none
Would you recommend Blue Buffalo wet kitten food? My 4 1/2 month old kitten seems tired by the same 4 choices (Fancy Feast).,blue buffalo wet kitten food? (1.00),4 1 / 2 month old kitten seems tired by the same 4 choices ( fancy feast ). (0.98),none,none,none,none
"Besides ketchup, what else do you dip French fries in that is delicious?",french fries in that is (0.90),none,none,ketchup (1.00),delicious (0.67),none
Why do people eat shrimp with their heads on?,shrimp with their heads on (1.00),none,none,none,none,none
Can a doctor consume a quantity of red meat?,doctor (0.90),quantity (0.73),red meat (1.00),none,none,none
How do you eat?,none,none,none,none,none,none
How can you get nutrients without eating fruits and vegetables?,nutrients (0.99),and vegetables (0.93),none,eating fruits (0.96),none,none
Is it right to eat fried eggs and bread for dinner?,fried eggs and bread for dinner (1.00),none,none,none,none,none
Can dogs eat fermented milk?,dogs (1.00),fermented milk (1.00),none,none,none,none
I'm Asian and prefer using a fork over chopsticks. Am I a rarity?,fork over chopsticks (1.00),##rity (1.00),none,ra (0.84),none,none
What is a list of fruits with many seeds?,fruits with many seeds (1.00),none,none,none,none,none
What happens when you eat more than your body needs for energy?,than (0.38),body (0.41),none,energy (0.90),none,none
How often do you eat ice cream?,ice cream? (1.00),none,none,none,none,none
Is processed food like sweet potato wedges just as bad as regular potato wedges without all the added things like E numbers and extra salt and stuff?,processed food (0.85),sweet potato wedges just as bad as regular potato wedges (1.00),the added things like e numbers and extra salt and stuff (0.91),all (1.00),none,none
Is Crocodile or Alligator meat very tasty? What does it taste like? How commonly eaten and how expensive to order at a restaurant? How compared to snake meat? Does it make you sick?,crocodile or alligator meat (1.00),tasty (0.98),it (0.98),how (0.43),it (0.73),none
Which plastic containers are microwave safe?,plastic containers (0.99),microwave safe (0.93),none,none,none,none
What do you think of people who allow their children (say 11 years old) to eat adult-sized meals and desserts in restaurants?,( say 11 years old ) (1.00),adult - sized meals and desserts (1.00),none,children (0.75),restaurants (0.93),none
What is the salt and ice diet?,salt and ice (1.00),none,none,none,none,none
What can I eat when I am positive in corona?,? (0.92),none,none,corona (1.00),none,none
I'm a 15 years old girl and I stopped eating meat in February but my skin condition has gotten so much worse. I have more acne than I used to and my cheeks get red all the time. Does somebody know why?,15 years old girl (1.00),meat (0.99),february (0.77),skin (0.45),worse (0.37),acne (1.00)
What is the maximum number of hot pockets that is acceptable to eat in one day?,hot pockets that (1.00),acceptable (0.68),eat in (0.79),none,none,none
Is it good to eat eggs every day on a keto diet?,eggs every day on (1.00),keto diet (0.93),none,none,none,none
What are some foods I should order for my boyfriend from overseas on Uber to make him feel loved?,boyfriend from overseas on uber (0.82),feel (0.49),loved (0.66),foods (0.57),none,none
What do you put in party food boxes?,party food boxes (1.00),none,none,none,none,none
Why does Cheese have the reputation of causing very bad dreams? How it is logically possible that Cheese does cause nightmares or bad dreams? Which other foods cause bad dreams too and how compared to cheese?,cheese (0.98),very bad dreams (1.00),it (0.61),other foods (0.63),cheese (0.94),none
What will happen if I eat five pounds of uncooked rice and chug a gallon of boiling water?,five pounds of uncooked rice and chug a gallon of boiling water (1.00),none,none,none,none,none
Is it unhealthy to eat mushrooms that grow from your pillow?,mushrooms that grow from (1.00),pillow (0.92),none,##health (0.54),none,none
"If someone swallowed the spiciest pepper, would it still be spicy after being pooped out or do the spicy properties subside after digestion?",spiciest pepper (1.00),it still (0.79),spicy after being pooped out (0.99),spicy (0.55),digest (0.97),none
How long does it take to wait for Uber Eats delivery?,uber eats delivery (1.00),none,none,none,none,none
What fruit was eaten by Adam and Hawa?,fruit (0.85),and hawa? (0.87),none,adam (0.59),none,none
"Is there any support in the Jewish community for eating poultry with dairy, since birds don't make milk, and thus, it only violates an arbitrary rabbinic decree, and not the eternal Torah?",jewish community (0.94),"poultry with dairy, since birds don't (0.87)",milk (0.85),eternal (0.83),none,none
How can I make cornbread in my air fryer?,cornbread in my air fryer (1.00),none,none,none,none,none
"When dating, should couples split the bill while out to eat?",the (0.99),bill while out (0.94),none,eat (0.84),none,none
"Do you believe your ancestral heritage, culture, and/or ethnic background influences your food choices?","ancestral heritage, culture, and / or ethnic (0.98)",food (0.58),none,background (0.50),choices (0.72),none
What should I eat late at night if I get hungry? I am trying to be healthy.,healthy (0.87),none,none,none,none,none
I eat 1000 calories a day and I count my calories. Is that enough? I’m 12 years old.,1000 calories a day (1.00),calories (0.98),none,none,none,none
"In English, if you say that a dish is ""quite nice ""actually"""" does that mean you didn't expect it to taste good, but to your surprise it does?",dish (1.00),""" quite nice "" actually "" "" (0.79)",none,good (0.75),none,none
Can vegetarians make up every single nutrient they sacrifice by not eating meat? Or is there any nutrient that they HAVE TO sacrifice?,vegetarian (0.50),single nutrient (0.77),none,not (0.88),eating (0.51),meat (0.95)
"How would a starving person react to suddenly having a lot of food? I'm writing a story, and I've read some, where they start eating a ton, but others where they are reluctant to eat a lot. Which would be more realistic?",starving person (1.00),having (0.53),lot of food (0.78),", (0.99)",eat (0.93),realistic (0.48)
Why am I always feeling super thirsty after eating at buffets? Is it due to the salt content or the MSG?,thirsty after eating (0.57),buffets (0.95),none,the (0.99),salt content or the msg (0.73),none
What is the best way to store banana nut bread?,banana nut bread (1.00),none,none,none,none,none
Is it OK to breastfeed in areas in which eating is expressly prohibited?,##fe (0.49),areas (0.80),none,breast (0.84),eating (1.00),expressly prohibited (0.87)
Are people who empty their meal plates in restaurants considered normal?,meal plates in restaurants (0.98),none,none,normal (0.71),none,none
"Eating has become a pointless endeavor over the past couple of months. I usually only drink a cup of juice and eat maybe one half of a sandwich and some fruit or granola. I feel perfectly fine, but my husband is a bit worried. What do I do?",pointless (0.87),couple (0.42),months (0.36),fruit or (0.84),none,none
How many types of watermelons exist?,##melons (1.00),none,none,water (0.81),none,none
"I’m 14, weigh 100lbs, and I’m 5’3. I’m turning 15 soon and still haven’t had my period and I’m barely a 32A bra size. I eat alot of healthy food and get about 3000 calories a day. What do I do?",100lbs (0.78),’ 3 (0.97),soon (1.00),period (0.94),3000 (0.81),none
At what temperature does the collagen in pork break down?,collagen in pork break down (1.00),none,none,none,none,none
Is it wrong to eat dolphin meat?,dolphin meat (1.00),none,none,none,none,none
Why do I feel more anger and aggression when weight training on a meat diet than on a vegetable diet?,meat (1.00),vegetable (0.91),none,anger and aggression when weight training (0.85),none,none
What makes rice from a Chinese restaurant sticky?,rice from a (0.98),chinese restaurant sticky? (1.00),none,none,none,none
I have not been hungry in 3 days. Is this normal?,3 (0.67),normal (0.51),none,days (0.37),none,none
What does it mean giving food to mad people?,food (0.99),mad people (0.99),none,none,none,none
"My dad won’t buy me food, all I get is a room. What do I do?",food (1.00),none,none,room (0.89),none,none
What is the most efficient and cost effective way for someone new to wine to taste a large cross section?,most efficient and (0.83),effective (0.90),large cross section (0.98),cost (0.78),wine (0.99),none
Is it bad for a dog to eat raw pizza?,dog (1.00),eat raw pizza (0.90),none,none,none,none
How long is Lactaid milk good for?,lactaid milk (1.00),for (0.79),none,none,none,none
How long does cake last in the fridge?,cake (1.00),fridge (0.57),none,none,none,none
What is the worst pizza topping you have eaten at a pizzeria?,worst pizza topping (0.94),at (0.46),pizzeria (0.99),none,none,none
Is hotel food harmful during pregnancy?,pregnancy (0.37),none,none,hotel food (0.99),none,none
"What effect would it have on your health to eat maggot infested meat, and have you ever done it?",maggot infested meat (1.00),none,none,none,none,none
Did the Prophet Muhammad eat fish?,prophet muhammad (0.98),fish (1.00),none,none,none,none
Is it a good idea to fast all day and not eat until dinner?,fast all day and not eat until dinner (0.85),none,none,none,none,none
Is picky eating a result of parenting methods during mealtimes?,picky (0.99),parenting methods during mealtimes (0.88),none,none,none,none
What will happen if someone drinks expired bottled water?,expired bottled water (1.00),none,none,none,none,none
Why do Westerners/white people eat dassie?,westerners / white people (1.00),dassie? (1.00),none,none,none,none
"Why don’t chefs wipe their knives after sharpening? I’ve sharpened knives before, and I’ve noticed metal dust when wiping the knife afterward?",chefs (0.88),knives after sharpening (1.00),knives (0.47),metal dust when (0.92),none,none
What does vinegar do to pastry dough?,pastry dough (1.00),none,none,vinegar (1.00),none,none
Is there a smoothie diet for vegans?,smoothie (1.00),vegans (1.00),none,none,none,none
Will there be peace on Earth when man no longer eats meat?,peace (0.41),none,none,man (0.38),meat (1.00),none
"Using team development stages model, descibe the steps for the formation of a temporary team which is formulated to establish a food chain franchise in your city?",development stages (0.95),temporary team (1.00),formulated (0.52),team (0.85),model (0.84),none
How do vegans eat their sourdough bread?,vega (1.00),sourdough bread? (0.93),none,none,none,none
"Why won't my cat eat meat? She eats dry cat food right now and she is one and a half years old. She won't eat any kind of meat, cooked or raw, but she will eat vegetables, fruits and other things.",cat (0.97),meat (1.00),dry cat food (1.00),none,none,none
Why is my dog not eating her dog food but likes to eat human foods? She's not sick by the way.,dog (0.88),dog food (1.00),human foods (0.80),sick by (0.47),none,none
What is the busiest Chick-Fil-A restaurant in the USA?,busiest chick - fil - a restaurant (0.99),usa (0.83),none,none,none,none
What is the most a restaurant has ever done for you after messing up your order?,restaurant (1.00),ever (0.30),order (0.62),most (0.49),none,none
"Which produces heat in the body, chicken or mutton?","body, chicken or mutton? (0.97)",none,none,heat in (0.70),none,none
What are food cravings and how do they work?,food (0.98),none,none,cravings (0.69),they (0.42),none
What foods contain the highest healthy chemical potential energy levels?,foods (0.91),highest (0.68),none,healthy chemical potential energy levels (0.97),none,none
Why do you whip egg whites for an angel food cake?,egg whites for an (0.99),angel food cake (1.00),none,none,none,none
Do you like ice cream soda?,ice cream soda (1.00),none,none,none,none,none
Is hunger truly the best sauce?,truly (0.57),the best sauce (0.99),none,none,none,none
"If you have worked at any fast food chain, what are some things customers aren't aware of?",fast food chain (1.00),none,none,customers (0.71),none,none
What products contain hidden sugar?,products (0.36),none,none,hidden sugar? (0.98),none,none
How many calories are in a coffee frappuccino?,##ories (1.00),coffee frappuccino? (1.00),none,cal (1.00),none,none
How do I stop my parents from forcing me to eat lots of food?,lots of food (0.99),none,none,none,none,none
How much CO2 is released from 1 kg of beef?,1 kg of beef (0.97),none,none,co2 is released from (0.89),none,none
How long without food until I pass out?,none,none,none,food (1.00),none,none
What is a food that starts with n?,food (1.00),none,none,n? (0.97),none,none
What food has the highest amount of Omega-3?,food (0.75),highest (0.71),none,amount (0.85),omega - 3? (1.00),none
"What foods make you wonder ""who was the first crazy person to taste that?""",""" (0.37)",first crazy person (0.82),that (0.76),foods (0.65),none,none
"How do I cook a wolf in Seattle, WA?","wolf in seattle, wa (1.00)",none,none,none,none,none
Why do South Koreans prefer to eat their food while it's still too hot?,south koreans (0.99),food (0.53),it (0.99),none,none,none
My next door neighbor has a huge tomato plant that has nice tomatoes hanging into my yard. Should I pick them or would that be wrong?,next door (0.99),huge tomato plant that has nice tomatoes hanging (0.98),yard (0.33),none,none,none
How many chicken wings are 3 oz?,chicken wings are 3 oz? (1.00),none,none,none,none,none
Do even the poorest people in the United States of America have unlimited access to food? Does the government there provide free meals to every family that requests it?,poorest people (0.99),united states of america (0.90),government (0.33),food (1.00),none,none
How do I eat poo for beginners?,poo for beginners? (1.00),none,none,none,none,none
What is the most classic street food in Italy?,most classic street food (0.87),italy (0.56),none,none,none,none
Is hospital food any good?,hospital (0.70),none,none,food (0.52),none,none
Is it safe to eat uncooked bacon?,uncooked bacon? (0.93),none,none,none,none,none
What foods are cheaper to make at home than to buy already made?,foods (0.85),already made (0.77),none,none,none,none
Do you need to dry tomato seeds from your bush to grow a new plant or can you plant a freshly picked tomato that has the seeds exposed in the dirt?,tomato seeds from your bush (1.00),new plant (1.00),freshly picked tomato (1.00),the (0.42),seeds (1.00),exposed (0.54)
Can we eat broken milk?,broken milk (1.00),none,none,none,none,none
Can I eat chocolate on a low-carb diet?,chocolate (1.00),low - carb diet (1.00),none,none,none,none
At what age should you cull your roosters to get the best meat?,roosters to get the best meat (0.99),none,none,none,none,none
Should I tip a pizza from Pizza Hut? Why?,pizza from pizza hut (1.00),none,none,none,none,none
Has anyone known to sterilize plant-based meat? Is it the same as how we sterilize conventional meat? I am looking for heating treatment for plant based meat.,##ril (0.55),plant - based meat (1.00),sterilize conventional meat (0.87),ste (1.00),##ize (0.72),heating (0.98)
Similar eggs have gone all frozen from the fridge. How do I make them soft again?,similar eggs (0.78),frozen from the fridge (0.80),soft again (0.96),none,none,none
What are the benefits of eating canned tuna?,canned tuna (1.00),none,none,none,none,none
Do you share your lunch with your siblings?,lunch (1.00),siblings (0.44),none,none,none,none
Are Doritos halal? Why or why not?,do (0.99),##ritos halal? why or why not (0.81),none,none,none,none
How much wasabi would kill me?,none,none,none,wasabi (1.00),none,none
What's the best way to get an egg off your windows?,egg off your windows (1.00),none,none,none,none,none
"Do African American citizens have the same access to fiber, nutrients, and fruits and vegetables as white (non African decent) citizens?",african american citizens (0.99),nutrients (0.69),white ( non african decent ) citizens (0.92),"fiber, (0.96)",", and fruits and vegetables (0.87)",none
"Given the fact that dining out/ordering food is very expensive in Greece, while the actual average wage there is around 300 euros per month, how are restaurants and fast food businesses able to operate in Greece?",dining out / ordering food (1.00),very expensive in greece (0.99),actual average wage there (0.97),300 (0.47),none,none
Can a pancake mix substitute for a cake mix?,pancake mix (1.00),cake mix (0.93),none,none,none,none
Do the French fix different foods for children the way Americans give the kid mac and cheese instead of what everyone else is eating?,french fix different foods (1.00),children the way americans give the kid mac and cheese instead of what everyone else (0.97),none,none,none,none
What should you eat if you're up late at night and hungry?,late (0.44),none,none,night (0.34),hungry (0.53),none
"Why do people assume I am vegetarian just because I don't eat meat often? I still eat meat, I just don't eat it in every meal.",meat (0.64),meal (0.77),none,meat often (0.99),it (0.63),none
