utterance,dishname_first (score),dishname_second (score),dishname_third (score),ingredient_first (score),ingredient_second (score),ingredient_third (score)
"How do we feel about bringing babies to eat in restaurants? Looking to hear from parents, servers, fellow diners, etc.",babies to eat in restaurants? (1.00),"hear from parents, servers, fellow diners (0.91)",etc. (0.74),none,none,none
Is Canadian food similar to American?,canadian food (0.95),? (0.98),none,american (0.94),none,none
Why does Oreo crème taste so good?,oreo creme taste (1.00),good (1.00),none,none,none,none
Why do Greek potatoes taste different (and better) from American potatoes?,greek potatoes taste different ( and better ) from american potatoes (0.97),none,none,none,none,none
Would you take a potato chip and eat it?,potato chip (1.00),it (1.00),none,none,none,none
My spouse is gaining weight after marriage and I'm the only one who cooks. He puts the blame on me and my food. What can I do?,none,none,none,weight (0.97),marriage (0.72),food (0.89)
What happened to the orange popsicles with vanilla ice cream inside?,orange popsicles with vanilla ice cream inside (1.00),none,none,none,none,none
How do you cook when you don't like cooking?,when (0.94),none,none,cooking (0.94),none,none
What are the worst foods for sugar?,worst (0.81),none,none,sugar (0.84),none,none
What is the best way to reuse a plastic milk jug?,plastic milk jug (1.00),none,none,none,none,none
How long after wisdom teeth removal can you eat sushi?,removal (0.70),sushi? (1.00),none,wisdom teeth (0.81),none,none
Why is sweet tea so popular in the South?,sweet tea (1.00),south (0.66),none,none,none,none
How rare can you eat a steak?,steak (1.00),none,none,none,none,none
How long after butchering would meat go bad if left out?,meat go bad if left out (1.00),none,none,butcher (0.87),none,none
"I tried the Paleo diet. After 3 days, I no longer had a sweet tooth or any urge to drink alcohol or eat junk food. Is this common?",paleo (1.00),days (0.72),alcohol or (1.00),3 (0.58),sweet tooth or any urge (0.84),junk (0.49)
Is it dangerous for a dog to eat yeast dough?,dog (1.00),yeast dough (0.99),none,none,none,none
What is your country's version of Spanish tapas?,spanish tapas? (0.98),none,none,none,none,none
Can't the Northern Ireland Jewish community obtain kosher foods and ingredients from the Republic of Ireland instead of getting them from Great Britain?,northern ireland jewish community (1.00),kosher foods and ingredients from the republic of ireland (1.00),them (0.56),none,none,none
Have you ever walked out of a restaurant after you were seated by a waiter or waitress?,restaurant (1.00),seated (0.66),or (0.81),waiter (0.85),waitress (0.52),none
"Why does lettuce get ""rusty red""? Is it okay to eat it?",lettuce (1.00),""" rusty red ""? (0.92)",it (0.99),none,none,none
What should you eat when you're tired of cooking?,none,none,none,cooking (1.00),none,none
What are the best foods to prevent acne for a vegan?,acne for a vegan (1.00),none,none,none,none,none
Why do people seem to think all fast food workers want $15 an hour?,all fast food workers want $ 15 an hour (0.93),none,none,none,none,none
Has a type of ice cream ever been marketed that contained crunchy bacon bits mixed with vanilla or French vanilla ice cream?,ice cream (1.00),contained crunchy bacon bits mixed with vanilla or french vanilla ice cream (1.00),none,none,none,none
Will consuming high-quality olive oil daily help a person live a long healthy life?,high - quality olive oil daily (1.00),long healthy life (0.99),none,none,none,none
Am I the only one who disliked meat before even knowing where it comes from? I thought kids were supposed to be picky eaters.,meat (0.87),kids (0.99),picky eaters (0.98),before (0.60),even knowing where it comes from (0.55),none
How do I make Captain D's fish batter?,captain d's fish batter (1.00),none,none,none,none,none
What does a cherry plum taste like?,cherry plum (1.00),none,none,none,none,none
Do you need to eat fish to get DHA?,fish to get dha (1.00),none,none,none,none,none
"You are sleeping, you are hungry, and you have butter cheese and juice in the fridge. What is the first thing you will open?",first thing (0.35),none,none,butter cheese and juice in the fridge (0.96),none,none
What foods are unhealthy to eat after being vaccinated against rabies?,foods (0.86),unhealthy (0.62),after being vaccinated against rabies (0.97),eat (0.36),none,none
What is the difference between sour cream and mayonnaise?,sour cream and mayonnaise? (1.00),none,none,none,none,none
Is it safe to store dry food in plastic containers?,dry food in plastic containers (1.00),none,none,none,none,none
What is dimorace?,dimorace (0.63),none,none,none,none,none
What is the rudest thing someone has done or said when you have hosted/cooked for them?,rudest thing (0.70),when (0.52),/ (0.57),done or said (0.38),hosted (0.60),cooked (0.41)
"When eating BBQ pork, do you want the meat to be shredded/chopped, pulled, small chunks or sliced?",bbq pork (1.00),meat (1.00),"be shredded / chopped, pulled, small chunks or sliced (1.00)",none,none,none
Are humans going to have to eventually become vegetarian? Should I do it now? (I’m honestly undecided on this and here to be convinced by sensible arguments),none,none,none,##ecided (0.37),this (0.87),sensible arguments ) (0.98)
What is that one food that you remember that made you fat?,one (0.44),fat (0.50),none,food (0.68),none,none
How long can a McDonald’s hamburger sit out before it actually tastes spoiled?,long (0.50),mcdonald ’ s hamburger sit out (1.00),it actually tastes spoiled (0.97),none,none,none
Can diabetics eat at Subway?,diabetics (0.92),subway (0.93),none,none,none,none
I want to gain muscle and lose fats at the same time. Should I cut my food portion in daily meals?,muscle (1.00),##s (0.78),same (0.61),fat (0.74),none,none
Why is giving up junk food so hard?,junk food (1.00),none,none,none,none,none
What happens if you cook with an unseasoned cast iron pan?,none,none,none,unseasoned cast iron pan (0.96),none,none
Is it okay to eat mango at night?,mango (1.00),none,none,none,none,none
How do you detox your body after eating junk food?,det (0.78),body after eating junk food (0.94),none,none,none,none
What are the food that helps to lose weight faster?,weight faster (0.76),none,none,food (0.99),none,none
What's the green stuff people eat with fish and chips? Is it guacamole?,green stuff people eat with fish and chips? (1.00),it guacamole? (0.93),none,none,none,none
What kind of animal likes to eat bananas at night? A certain animal is stealing and eating bananas from our house location in Bhagalpur (Bihar).,animal (0.51),bananas (1.00),night (0.98),b (0.33),none,none
"I don't eat non-veg but cook non-veg food for my in-laws, does it effect my spiritual growth?",non - veg (1.00),non - veg food (1.00),in - laws (1.00),none,none,none
"Do cats really prefer eating from the food container rather than from their bowl? If that’s not unusual, how do I get my cat to eat from the bowl itself?",cats (1.00),from the (0.87),food container rather (0.79),eating (0.59),unusual (0.25),none
Is cheddar on Philly cheese steaks relatively good?,cheddar on philly cheese steaks relatively good (0.98),none,none,none,none,none
Were nuts considered unhealthy in the past?,unhea (0.58),##y (0.53),none,nuts (0.48),##lth (0.38),past (0.50)
What foods are good after radiation exposure?,foods (0.83),good (0.46),none,after (0.35),radiation exposure (0.80),none
What foods are high in natural sugar?,foods (0.97),none,none,natural sugar? (1.00),none,none
How much uncooked rice makes 1 cup cooked?,1 cup cooked? (1.00),none,none,uncooked rice makes (0.87),none,none
Is it okay to eat burgers from McDonald's on keto diet if you order it without the bun and any condiments with carbs?,burgers from mcdonald's on keto diet (1.00),and any con (0.93),##s with (0.92),the bun (0.73),##diment (1.00),car (0.97)
How can eating Takis kill you?,none,none,none,takis (0.98),none,none
What types of chicken pieces make up an 8-piece KFC chicken bucket?,pieces (1.00),8 - piece kfc chicken bucket (1.00),none,chicken (1.00),none,none
What should be eaten during Thursday Fast?,thursday fast (0.95),none,none,none,none,none
"How do I skip dinner when my parents make me eat it? I find ways to skip other meals, but I feel disgusting when I eat dinner. (Please just give me answers-i know it isnt healthy but I feel so fat and I need ways to skip dinner)",dinner (1.00),it (0.63),other (0.45),disgusting (0.69),it (0.56),healthy (0.53)
Which cultures completely avoid meat consumption?,none,none,none,meat consumption (1.00),none,none
I feel full and hungry at the same time. What should I do?,none,none,none,none,none,none
What is Jaehyun's favorite food?,jaehyun's favorite food (1.00),none,none,none,none,none
How did you deal with a coworker eating your food?,coworker eating your food (1.00),none,none,none,none,none
What are the best Chinese snacks?,the best chinese snacks (1.00),none,none,none,none,none
Which eating habit is ordinary in your country but strange in the rest of the world?,eating (0.93),ordinary (0.55),country (0.35),habit (0.79),strange (0.34),none
How much should I charge for my meal prep plan? It includes 6 meals and is very healthy.,meal prep plan (1.00),meals (0.99),none,6 (1.00),healthy (0.66),none
What happens to the mind with consciousness after spiritual awakening?,mind with consciousness after spiritual awakening (0.89),none,none,none,none,none
Discuss the type and use of growth promoters feed additives in animal nutrition? What are your recommendations for using feed additives for milk enhancement in dairy and meat production in beef animals.,growth promoters feed additives in animal nutrition (1.00),feed additives for milk enhancement (1.00),and (0.99),type (0.65),dairy (0.82),meat (0.86)
What do I do if I don't want to share my food?,food (0.76),none,none,none,none,none
What do we call a person who cuts and sells meat?,meat (0.67),none,none,none,none,none
"My dad ate a pizza with a pound of cheese and a pound of peperoni and he eats alot of junk food, nobody can stop him from eating not even me and even when I try to tell him to stop he doesnt stop eating junk food and im worried what do I do?",pizza with a (1.00),of cheese and a pound of peperoni (1.00),eats alot of junk food (0.93),pound (0.53),nobody (0.54),not (0.77)
"How did 'kimchi', a type of food known to be eaten by peasants and those in famines due to its preservative quality, become the pride of Korea?",kimchi ' (0.98),type of food (0.88),eaten (0.82),famine (0.97),its (0.55),preservative quality (0.97)
Is dark chocolate good or bad for your heart?,chocolate good or bad (0.61),heart (0.60),none,dark (0.94),none,none
What are healthy snacks that keep you full?,full (0.42),none,none,healthy snacks (0.69),none,none
"Will parboiling a potato with the skin on before I microwave it make it less lumpy? If so, how long should it be parboiled, or is there something better to get a quicker baked potato?",##bo (0.68),potato with the skin on before i microwave it (1.00),it less lumpy (1.00),par (0.98),par (0.99),none
What chain restaurant(s) does your spouse love?,chain restaurant ( (0.92),) (0.52),spouse love (0.80),s (0.62),none,none
"Is the term ""sea salt"" redundant? Doesn’t all table salt come from the sea?","sea salt "" redundant (0.99)",table salt (1.00),from (0.49),all (0.57),none,none
How long do you water bath salsa?,water bath salsa (1.00),none,none,none,none,none
Watching a YouTube video today I realised I had never tried goat meat. I’ve never seen it in a UK supermarket. Where/how could I get some? What does it taste like? Is it worth trying? What cut do I get?,youtube (1.00),goat meat (0.99),uk supermarket (0.93),? (0.99),trying (0.99),cut (0.68)
Why is tomato ketchup banned in France?,tomato ketchup banned (1.00),france (0.98),none,none,none,none
Have you ever tried coffee that tasted like it smelled?,coffee that tasted like it smelled (0.95),none,none,none,none,none
If I eat rice will my belly increase in size?,rice (0.94),belly (0.95),none,size (0.81),none,none
Does a cat need to eat rice?,cat (1.00),rice (1.00),none,none,none,none
Why do all Subways have a weird kind of chemical smell whenever you walk in? Is it some kind of preservative they put in their decrepit bread?,subways (1.00),weird kind of chemical smell whenever (1.00),in (0.83),none,none,none
Is it safe to eat oysters during pregnancy?,oysters (1.00),pregnancy (0.70),none,none,none,none
How can my food control my mood?,none,none,none,food (0.99),mood (0.50),none
"I have brownie mix but no eggs, what is the best substitute for the eggs?",best (0.60),eggs? (0.81),none,brownie mix (1.00),"eggs, what (0.90)",the (0.84)
Can you eat cake for dinner?,cake (1.00),dinner (0.84),none,none,none,none
Who eats rice with bananas?,rice with bananas (1.00),none,none,none,none,none
What's the problem with butter in Canada?,butter in canada (0.98),none,none,none,none,none
Are chicken wings healthy? Why or why not?,chicken wings healthy (0.82),why (0.27),why not (0.53),none,none,none
How can I get hungry in 5~10 minutes?,hungry (0.60),5 ~ 10 minutes? (0.90),none,none,none,none
My friends keep mocking me for being a vegetarian. How can I start eating meat?,meat (1.00),none,none,none,none,none
What foods shouldn't be eaten straight out of a can?,foods (0.93),eaten straight out of a can (0.96),none,none,none,none
What are the worst foods for belly fat?,worst (0.59),belly fat (1.00),none,none,none,none
What was the single best food or beverage you put into your mouth in recent memory?,single best food or beverage you put into (0.99),mouth (1.00),recent memory (0.96),none,none,none
"If you can only eat one vegetable, which one would give you the most nutritional value?",vegetable (1.00),one (0.53),most (0.44),nutritional value (0.85),none,none
How did the different civilisations learn to eat foods with dipping sauces?,different civilisation (0.90),foods with dipping sauces (1.00),none,none,none,none
I just got my 7-week-old pug. What food should I feed him?,7 - week - old pug (1.00),none,none,food (0.89),none,none
What happens when you eat too much icing?,too much icing (1.00),none,none,none,none,none
"If mangoes are slightly brown and soft inside, have they gone bad?",mangoes (1.00),slightly brown and soft inside (0.99),none,gone (0.68),bad (0.74),none
I'm 14 years old and a very picky eater. I don't like any fruits or vegetables except bananas. It hasn't been a health issue but it's just embarrassing. How can I bring myself to try new foods?,very (0.92),picky eater (0.92),or (0.68),fruits (0.99),vegetables except bananas (0.82),embarrassing (0.56)
Why do I feel so nauseated when I think about eating?,nausea (0.77),none,none,##ted (0.37),eating (0.93),none
How much watermelon is too much? I can eat 3-5 pounds a day while in season.,##melon is too much (0.96),3 - 5 pounds a day (1.00),none,water (1.00),season (0.74),none
"What would a fusion of pancakes, waffles, and French toast look like?",fusion (0.99),"pancakes, waffles, and french toast (1.00)",none,none,none,none
"Is it possible for an all-kosher diet to still be enjoyable and tasty, or is it too deprived?",all - kosher diet (1.00),be enjoyable and tasty (0.97),none,still (0.37),deprived (0.57),none
What does soaking onions in milk do?,soaking onions in milk do (0.97),none,none,none,none,none
Can I eat mushroom and milk together?,mushroom and milk together (1.00),none,none,none,none,none
What type of meat scares you the most?,none,none,none,meat (1.00),none,none
What is the most comforting smell in the world?,most (0.58),comforting (0.93),none,smell (0.29),none,none
How do you handle a situation where someone shows up empty handed to a potluck and then wants to leave with a load of leftovers?,empty handed to a potluck and then (0.97),none,none,leftovers (0.93),none,none
What is the historical background of Chinese people eating almost everything as a food?,chinese people eating almost everything as a food (0.94),none,none,historical (0.87),none,none
Is rancid olive oil bitter?,rancid olive oil bitter (1.00),none,none,none,none,none
Is it okay to eat a leftover burger after I refrigerated it and left it overnight?,leftover burger after i refrigerated it and left it overnight (1.00),none,none,none,none,none
How much sodium is in cream cheese?,cream cheese (1.00),none,none,sodium is in (0.96),none,none
"If you have 3 eggs for breakfast and you are 4 people, what would you do?",people (0.78),none,none,3 eggs for breakfast (0.92),4 (0.60),none
"If I ate 652 calories a day but ate lots of protein and nutrients, would I get sick?",652 calories a day but (0.96),lots of (0.89),and nutrients (1.00),protein (0.90),none,none
"Which should I take on day two of food poisoning? I am having bad nausea, Kaopectate or Gravol?",day two of food poisoning (1.00),"nausea, kaopectate or gravol? (0.99)",none,bad (0.99),none,none
What country in the world has the best food?,the best (0.61),none,none,food? (0.91),none,none
Is the Doritos Locos Taco authentic Mexican food?,doritos locos taco authentic mexican food (1.00),none,none,none,none,none
"Is it unhealthy to eat less than half of one meal per day? I'm 5'5"" and weigh 112 lbs, so I'm not thin. I really don't get that hungry. Besides, I've always had a mental aversion to food.",unhealth (0.56),less than half of one meal per day (1.00),"' 5 "" (0.98)",112 (0.51),mental avers (0.68),food (1.00)
Why do vegetarians try to shame people who eat meat when plants are alive too?,vegetarian (0.51),people (0.58),meat when plants are alive too (0.85),none,none,none
How do I make crispy onion cabbage pakora? https://youtu.be/vikNDXY0i2U,crispy onion cabbage pakora? https : / / youtu. be / vikndxy0i2u (1.00),none,none,none,none,none
Is itopride before or after food or between food?,itopride (0.65),or after food or between food (0.78),none,none,none,none
How come my sodium and saturated fat intake is high even though I eat healthy?,sodium and saturated fat intake (1.00),high (0.60),none,healthy (0.95),none,none
Why is the butter I made not potent enough?,butter (1.00),none,none,potent enough (0.64),none,none
What should you eat everyday to stay healthy?,everyday (0.50),healthy (0.52),none,none,none,none
How long should I wait between breakfast and a workout?,breakfast (0.98),workout (0.49),none,none,none,none
My therapist started eating lunch during our session. It was a full dinner plate of salmon and sides. I told her I felt like she didn’t give me her full attention. How bad is it for her to have done this?,lunch (1.00),session (0.79),it (0.54),none,none,none
Is Tabasco a good sauce to put on sardines?,tabasco (0.99),sauce (0.99),sardines (0.92),none,none,none
Did McDonald's give me food poisoning?,food (1.00),none,none,mcdonald's (0.96),poisoning (0.57),none
Why do eggs and pineapples not go together?,eggs and pineapples not go together (0.93),none,none,none,none,none
What country is most famous for chocolate?,none,none,none,chocolate (1.00),none,none
What if your school cafeteria ladies refuse to serve kids lunch and go on a strike for higher pay?,school cafeteria ladies (0.98),kids lunch (1.00),pay (0.98),higher (0.95),none,none
Where does Chik-Fil-A get its chicken from? Is it Tyson?,chik - fil - a get its chicken from (0.98),? (1.00),none,tyson (0.98),none,none
Can vegans eat meringue since only the yolk grows to be a chick and not the egg white?,vega (0.97),meringue since only the yolk grows to be a (1.00),chick (0.72),none,none,none
How much ice cream is in a scoop?,scoop (1.00),none,none,ice cream (1.00),in (0.61),none
What would happen if I injected guacamole in my bloodstream?,guacamole in (0.99),bloodstream (1.00),none,none,none,none
Can you eat rusty lettuce?,rusty lettuce (1.00),none,none,none,none,none
Why is eating too much pizzas and burgers bad for you?,too much (0.80),pizzas and burgers (0.95),none,none,none,none
Can you get a sausage that's like a haggis in size that's cooked in an oven?,sausage (1.00),' s like a haggis in size that's (0.95),in an oven (0.90),cooked (0.60),none,none
Can I eat raw mango during a fever?,raw mango during (1.00),fever (1.00),none,none,none,none
What happens to your body if you never eat vegetables?,body (0.37),vegetables (1.00),none,none,none,none
Are ham shank bones okay for my dog to chew on?,ham shank bones (1.00),dog (0.96),on (0.65),none,none,none
Can DoorDash pick up multiple orders?,doordash (0.98),multiple orders (1.00),none,none,none,none
"If a restaurant customer drops their food on the floor accidentally (like a whole burger), should the restaurant replace it or should the customer?",restaurant customer (0.99),food on the floor accidentally ( like a whole burger ) (0.93),restaurant (0.62),it (0.60),customer (0.92),none
"Science has discovered how to make all kinds of candy very healthy, a meal in itself, low calorie, sustainable and tastes as good as before. What are you having for dinner and how often do you have it each week?","all kinds of candy very healthy, a meal in itself, low calorie, sustainable and (1.00)",dinner (0.91),often (0.99),tastes (0.43),good (0.94),before (0.59)
"If I eat in small portions, like cutting it in halves or in quarters, without counting the calorie content of every food, can I still lose weight?",small portions (0.80),it in halves or in quarters (0.95),every food (0.59),counting (1.00),calorie content (0.98),weight (1.00)
What do you eat on a raw food diet?,raw food (1.00),none,none,none,none,none
"If you ordered pamplemousse in a French restaurant, what would you be served?",pamplemousse in a french restaurant (1.00),none,none,none,none,none
How do I shut down radical vegans claiming that eating meat is abusing animals?,radical vegans claiming (0.97),meat is abusing (0.80),none,animals (0.81),none,none
If you left macaroni and cheese out for less than 24 hours and then put it in the fridge is it still good?,macaroni and cheese out for less than 24 hours (0.97),it (0.97),fridge (0.39),good (0.63),none,none
There is a warning on the back of some seaweed I bought saying it can expose you to cadmium and lead. Is this something I should be worried about?,back (0.45),seaweed i bought saying it can (1.00),##mium and lead (1.00),cad (0.98),none,none
"I was crushing dried catnip leaves and there was fine almost powdered catnip on the end of the pestle, so I snorted it, is this fine?",dried catnip leaves (1.00),there was (0.76),almost powdered catnip on the end of the pestle (1.00),fine (0.59),fine (0.31),none
Is white rice and chicken a good diet for losing weight?,white rice and chicken (1.00),weight (0.86),none,losing (0.96),none,none
Which tribe has the best soup in Nigeria?,tribe (0.47),the best soup (0.99),nigeria (0.95),none,none,none
"If peanuts were a true nut, would people still have allergies to them?",peanuts (1.00),true nut (1.00),people (0.37),allergies to them (0.88),none,none
Is McDonald's selling frozen or fresh burgers?,mcdonald's selling frozen or fresh burgers (0.96),none,none,none,none,none
Why should not eat mango and milk together?,mango and milk together (1.00),none,none,none,none,none
Is it arduous to form baby food?,baby food (1.00),none,none,ar (0.88),none,none
Is it okay to eat expired cereal?,expired cereal (1.00),none,none,none,none,none
What should I eat before a water fast?,water fast (1.00),none,none,none,none,none
Why is it okay to eat cheese if it's moldy but not other foods?,cheese if it's moldy but not other foods (0.99),none,none,none,none,none
What can my wife do about finding a band aid in her food from a fast food restaurant?,band aid in her food from a fast food restaurant (1.00),none,none,none,none,none
What does it mean to have a dream about seeing someone eating lots of salad?,eating lots of salad (0.88),none,none,none,none,none
What do you eat every day?,none,none,none,none,none,none
Why dont I feel hungry ever? (recovering from an eating disorder),hungry ever? ( recovering (0.99),disorder ) (0.97),none,eating (0.59),none,none
"When you bake a layer cake in standard cake pans, should you put the cake pans straight on the oven rack or on a cookie sheet that goes on the oven rack?",layer cake in standard cake pans (1.00),cake pans straight on the oven rack (1.00),cookie sheet that goes on (0.96),none,none,none
How much bread is in a bagel?,bagel? (1.00),none,none,bread (0.52),none,none
How can I lose belly fat while eating fast food?,fat (0.94),fast food (1.00),none,belly (0.98),none,none
What would you eat at 3 am?,3 am (0.88),none,none,none,none,none
What nuts are bad for cats?,cats (0.91),none,none,nuts (0.45),none,none
Does breakfast sausage go bad in the refrigerator?,breakfast sausage (1.00),bad in the refrigerator (0.99),none,none,none,none
What is the best way to store mushrooms at home?,mushrooms (1.00),none,none,none,none,none
Why do people eat corn starch right out the box?,corn starch right out the box (1.00),none,none,none,none,none
I started hating people who consume beef. Is that right or wrong?,beef (1.00),right or wrong (0.50),none,none,none,none
"When invited to someone's home to dinner, is it rude to ask to take food home?",food (0.74),none,none,home (0.31),none,none
What are some emotions that affect food choices?,food choices (0.79),none,none,emotions (1.00),none,none
How much protein does 100 gm of paneer have?,100 gm of paneer (1.00),none,none,protein (1.00),none,none
Which Burger King outlets accept EBT?,burger king outlets (1.00),##bt? (0.75),none,e (1.00),none,none
"I am conducting a survey for males vs females. If male, how many pizza toppings do you like on your pizza? If female, how many pizza toppings do you like on your pizza?",males vs females (0.99),male (0.79),many pizza toppings (0.98),none,none,none
What does vanilla sugar do in baking?,vanilla sugar (1.00),none,none,baking (0.82),none,none
